781.jpg,26,2019-08-20,0,Salvini,gli italiani vogliono porti chiusi prima gli italiani,0
782.jpg,188,2019-08-29,0,"Meloni, Salvini","molti si fanno abbindolare, sia dalla meloni che da salvini co sta cosa che tutti gli altri sono attaccati alle poltrone tranne loro. la meloni la manteniamo noi dal 1998, salvini dal 1993. la loro non è una poltrona. è un divano-letto ormai. #wakeup",1
783.jpg,34,2019-08-21,0,Conte,"di maio, di battista",0
784.jpg,5,2019-08-20,0,"Salvini, Conte","quando il prof ti dice ""ci vediamo al prossimo appello""",1
785.jpg,28,2019-08-31,0,0,"far cadere il governo conte e andare subito al voto tanto in parlamento non ci sono altre maggioranza ritrovarsi un governo m5s-pd senza elezioni ritrovarsi un governo m5s-pd senza elezioni salvini di maio premier! (ho sbagliato, pls torna con me)",1
786.jpg,12,2019-08-22,0,Mattarella,tenetemi,0
787.jpg,9,2019-08-21,1,0,banned: the server has automatically banned you for saying a bad word. you said: presidente del consiglio eletto dal popolo okay,1
788.jpg,8,2019-10-08,0,0,ma tra tutte queste parole da sincope di governo io mi domando: ma la legge elettorale?,0
789.jpg,486,2019-08-19,0,Berlusconi,erezioni subito,1
790.jpg,1,2019-11-20,0,"Salvini, Zingaretti, Bussetti, Conte",stannu settati e se la sucanu a vicenda,1
791.jpg,14,2019-08-21,0,0,onnivori a caccia di fauna da deflorare #suppostafilosofia,0
792.jpg,4,2019-09-04,0,0,"una domanda lecita...il ministro della giustizia, bonafede salute, speranza ambiente, costa ma gli incarichi li hanno dati per abbinamento?",0
793.jpg,12,2019-09-03,0,0,scanzi scrive che bisogna temere uno che è riuscito a dilapidare una fortuna elettorale in pochi mesi.. ma stava parlando di di maio?! renzi. ...ah ecco..,0
794.jpg,12,2019-08-28,0,Meloni,governo pd - m5s 100% in olio d'ulivo,1
795.jpg,3,2019-08-20,0,Salvini,mojito interruptus,1
796.jpg,27,2019-08-20,0,"Salvini, Di Maio","le ho avute per bere e per sciacquare, terùn alla facciacciatua, capitò",0
797.jpg,14,2019-09-01,1,"Di Maio, Conte, Salvini",ctrl alt canc,1
798.jpg,29,2019-08-18,0,0,il messaggero.it news quota 100 è un flop: ogni dieci uscite solo tre assunzioni,0
799.jpg,33,2019-08-28,0,0,forse c'è qualcosa di peggio dei sogni svaniti...perdere la voglia di sognare ancora. (sigmund freud),0
800.jpg,38,2019-08-28,0,0,chiara becchimanzi la page 1 ora ma quindi mattarella oggi sceglie? o deve fare ancora l'ultima esterna? #crisidigoverno #lascelta #uominiedonne #nomariaioesco #sergiotronista #amoreaitempidei5s mi piace commenta condividi rosario catananti fai la domandina è indeciso tra te ( chiara becchimanzi ) e conte ( quello che,0
801.jpg,21153,2019-08-28,1,0,pensionato preme per sbaglio un banner sulla piattaforma rousseau e si ritrova ministro dell'economia,1
802.jpg,69,2019-08-28,1,0,"due cose sono infinite: l'universo e le spaccature nel pd, e riguardo l'universo ho ancora dei dubbi",1
803.jpg,23,2019-08-29,0,"Zingaretti, Conte, Di Maio",no al patto della poltrona. mobilitazione in piazza montecitorio,0
804.jpg,864,2019-08-12,1,0,quando si apre la crisi di governo e la possibilità che salvini diventi premier ma tu sai che potrai fare un'altra maratona,1
805.jpg,635,2019-08-24,0,0,risolviamo la crisi trovando un accordo a lungo termine diamo all’italia un governo antifascista! di fronte al pericolo di un paese consegnato alle perverse politiche della lega uniamo le forze e mettiamo da parte i risentimenti per regalare all’italia un futuro.,0
806.jpg,446,2019-08-10,0,0,salvini prepara la crisi di governo,0
807.jpg,2,2019-08-12,0,0,"e quindi matteo dichiara crisi e scissione. io pensavo a salvini matteo, mi sveglio e capisco che il matteo in questione è renzi che decide di aprire una crisi all'interno del pd e questa volta lo fa avendo già perso le elezioni. o perdi o vinci, o cadi o ti risollevi, in italia abbiamo la certezza di avere il pd in crisi. come perdere di nuovo le elezioni e scrivere un comunicato stampa dichiarando di non aver perso ma semplicemente di non aver vinto. atto terzo dello psicodramma chiamato partito democratico",0
808.jpg,5,2019-08-28,1,"M5S, PD",marzo 2018 agosto 2019,1
809.jpg,1589,2019-09-04,0,0,giuseppe civati @civati quindi non è stato salvini a presentare una mozione di sfiducia ma è stata la merkel che ha dettato la mozione di sfiducia a salvini che poi l'ha presentata in senato. ora è tutto più chiaro. #colpodistatus 19:36 02 set 19 twitter web app,0
810.jpg,0,2019-08-14,0,0,ultimi giorni per iscriversi ai viaggi della speranza sulla piattaforma rousseau.,1
811.jpg,6,2019-08-21,0,0,ricordo a tutti gli elettori della #lega che il 4 marzo 2018 #salvini è salito con il 17% e grazie al #p5s perché il #movimento5stelle solo ha preso il 36% tanto per ricordare!!,0
812.jpg,52,2019-08-23,1,0,quando mattarella convoca nuove consultazioni per martedì,1
813.jpg,50,2019-08-29,0,Salvini,sabato 19 ottobre roma lega salvini premier,0
814.jpg,6,2019-08-12,0,0,"tu sai già odiare? certo, non sono mica nata ieri.",0
815.jpg,88,2020-04-05,0,0,conversazioni tra ministri degli esteri. di maio. gli altri ministri europei,1
816.jpg,9,2019-08-10,0,0,"quindi niente flat tax, niente taglio delle accise, nessuna riforma della giustizia, niente salario minimo e con il rischio concreto che l'iva aumenti di 2 punti? mi state dicendo che, in sintesi, #salvini in un anno di governo ha solo bloccato 3 navi? #crisidigoverno",0
817.jpg,170,2019-08-16,0,0,quando ti imbatti in un leghista sui social: years of academy training wasted,1
818.jpg,5,2019-09-04,0,0,"oltre offerte sisa i supermercati italiani nicky carta igienica elite 4 rotoli €1,19 dal 5 al 11 settembre 2019",0
819.jpg,4,2019-08-20,0,0,agli uomini e alle donne del centrodestra vorrei raccomandare di non abbandonarsi alla frustrazione. un eventuale governo pd-cinque stelle porterebbe le forze che lo compongono ad una sicura implosione nell'arco di pochi mesi. sia per le differenze di visione sia per l'ostilità del popolo che non comprenderebbe l'ennesimo tentativo di ignorare la sua volontà,0
820.jpg,104,2019-08-12,0,Grillo,mia moglie mi chiama al telefono prontooooooooooo è cambiato tutto ah no spe ho sbagliato comico,1
821.jpg,115,2019-08-13,0,0,salvini sconfitto. il parlamento non è il papeete. votazione chiusa,0
822.jpg,3,2019-08-31,0,Mattarella,me faccio vivo io,1
823.jpg,11,2019-08-11,0,0,"rai. per te, per tutti.",0
824.jpg,30,2019-08-21,0,Salvini,preview divise autunno/inverno 2019,0
825.jpg,134,2020-08-04,1,Salvini,se dire cazzate fosse un reato a lui darebbero l'ergastolo,1
826.jpg,9,2019-08-29,0,0,pd,0
827.jpg,1043,2019-06-13,0,0,come sopravvivi senza cervello? prima gli italiani!,1
828.jpg,22,2019-08-09,0,"Salvini, Di Maio",crisi di governo - la lega farà gli interessi del nors e dei più forti non regaliamogli l’italia è ora di agire!,0
829.jpg,5,2019-08-12,0,0,quando voti 5 stelle ma è l'8 agosto,1
830.jpg,424,2019-08-18,0,"Meloni, Salvini","nervosismo tra alleati... ahó, ma 'nsomma, annamo o non annamo a governà? ma va cagher, terùn",0
831.jpg,15,2019-08-21,1,Salvini,already annoyed best kenny omega reactions long version from the g1 press confrence,1
832.jpg,301,2019-08-12,0,"Grillo, Renzi, Di Maio, Mattarella, Salvini",ops! governo,0
833.jpg,65,2019-08-30,0,Di Maio,si addormenta sul materassino con la lega e lo ritrovano 9 ore dopo con il pd.,1
834.jpg,14,2019-08-14,0,De Magistris,"""è arrivato il momento di scendere in campo a livello nazionale"" - luigi de magistris",0
835.jpg,11,2018-01-12,0,0,"un bacio, insomma, che cos'è mai un bacio? un apostrofo rosa fra le parole ""s'alvinimmerda""",1
836.jpg,8,2019-08-22,0,0,il presidente mattarella vero innovatore e rottamatore #crisidigoverno #consultazioni #mattarella #maratonamentana,0
837.jpg,10,2019-08-31,0,0,l'idiota considera falso tutto ciò che non è in grado di comprendere tommaso d'aquino,0
838.jpg,177,2020-09-02,0,0,come puoi soravvivere senza cervello? grazie al cuore immacolato di maria che mi dà la forza.,1
839.jpg,994,2019-05-09,1,Lega,suca salvini rosica,1
840.jpg,27,2019-08-28,0,Conte,il futuro è adesso il repliconte,0
841.jpg,6,2019-08-20,0,"Salvini, Conte","habermas, buber? che so? cavalli? no, so fantini",1
842.jpg,79,2019-08-28,0,0,"di maio salvini ricordi come arrivare a palazzo chigi? credo di sì, ma perché dovrei saperlo?",1
843.jpg,11,2019-08-10,0,0,"voglio pieni poteri ok, peggio di weimar non potrai fare",0
844.jpg,22,2019-08-28,0,0,"4 vicepremier? no, due testimoni. aspettiamo rousseau? no, partecipazioni classiche. carne o pesce? gli ospiti devono mangiare. e l'angolo cubano?",0
845.jpg,426,2019-08-21,0,Salvini,ho telefono sansun galass crand neo eeee. voi che facete? ciao #letterman83,1
846.jpg,15,2019-08-20,0,M5S,destra sinistra m5s,1
847.jpg,4,2019-08-29,0,Salvini,"funweek matteo salvini, addio a francesca vedini: attrazione con un ex tentatore di temptation island? di alessia malorgio 3 minuti ago",0
848.jpg,7,2019-08-21,0,Mattarella,"sarvini gl'ha fatto come quello che si taglio' i'pisello pe' fa' dispetto alla su moglie! sfiduciando il governo, con una mossa politicamente ardita, il leader della lega nord non ha calcolato bene le conseguenze",1
849.jpg,630,2019-08-24,0,0,il pd rappresentala vecchia politica il pd ruba il pd è attaccato alle poltrone ed ai vitalizi non ci si può fidare del pd il pd fa gli interessi delle banche mai col partito di bibbiano stiamo lavorando ad un governo con il pd,1
850.jpg,42,2019-08-26,0,0,la parola agli italiani subito al voto fratelli d’italia,0
851.jpg,654,2019-08-10,0,"Salvini, Conte, Grillo, Di Maio","bravi, l'avete votato il decreto sicurezza bis?",0
852.jpg,32,2019-08-21,0,0,"piazza affari in forte rialzo e spread in calo, il mercato scommette su un nuovo governo",0
853.jpg,72,2019-08-31,1,"M5S, Lega, PD","32%+17%=49% rappresenta gli italiani! 32%+19%=51% non rappresenta gli italiani! ""la scienza non ha ancora dato una spiegazione a tutto questo""",1
854.jpg,36,2019-09-02,1,Conte,the vice of italy,1
855.jpg,12,2019-10-09,1,Salvini,elezioni subito,1
856.jpg,1515,2020-05-15,1,Conte,la vendetta dei parrucchiere,1
857.jpg,20,2019-09-17,0,"Salvini, Renzi",i dei mattei. ok ragazzi vi riporto a casa!!,1
858.jpg,20,2019-08-19,0,0,servizio di luca colantoni,0
859.jpg,0,2019-08-08,1,0,"mentana, non allontanarti per le ferie #crisidigoverno",1
860.jpg,50,2019-10-02,1,Salvini,avete rubato i miei sogni,1
861.jpg,57,2019-08-17,0,Salvini,l'esorcistar,1
862.jpg,13,2019-08-28,0,"Mattarella, Salvini","""e vabbè dai... se semo fatti na passeggiata""",1
863.jpg,91,2019-08-28,0,0,l'agenda di fidanza mercoledì 28 agosto ore 21:30 mediaset tgcom24 fratelli d’italia,0
864.jpg,452,2019-08-13,0,"Boschi, Renzi","renzi pronto a lanciare azione civile. ingroia: ""ma quella è la mia sigla"" ""guarda che me sa che 'azione civile' già esiste"" ""volemo fa 'zingaretti suca'?""",1
865.jpg,10,2019-08-20,0,0,"spinoza.it 1 minuto sto ascoltando il discorso di conte. non avevo mai sentito un eufemismo così lungo per ""testa di cazzo"".",0
866.jpg,17,2019-08-21,0,0,"""...il cambiamento si fa dentro la cabina elettorale con la matita in mano..."" (p. borsellino)",0
867.jpg,163,2019-08-17,0,0,"quando ad un raduno della lega un ubriaco inizia a cantare ""senti che puzza, scappano anche i cani"" un popolo grezzo, rude, ma incontrastabile",0
868.jpg,17,2019-08-20,0,Conte,la politica lo statista real politics the statesman,0
869.jpg,4,2019-08-29,0,0,"odissea1968 be' quello che è successo in #granbretagna è veramente grave. sospendere il #parlamento? e la #democrazia? balzo indietro di coloro , gli inglesi, che ci hanno sempre voluto fare lezioni. ma lezioni di che? #brexit #golpe #crisidigoverno #regina abdica",0
870.jpg,77,2018-12-21,0,0,"leghista: ""sei un comunista di merda. salvini è un grande. tu devi solo stare zitto comunista di merda!"" io: ""ora sta' zitto e ascolta, idiota""",1
871.jpg,43,2019-08-26,0,0,omnibus la7 domani dalle 8 @emanuelefiano @isabellarauti @demanzoni @bendellavedova @gparagone ospiti di @penna74 #omnibula7 #crisidigoverno #tgla7 #maratonamentana,0
872.jpg,15,2019-08-09,0,0,governo al capolinea ci saranno nuove elezioni o i populisti punteranno a un governo tecnico a cui dar la colpa dei loro fallimenti e delle misure lacrime e sangue che serviranno per provare a salvare il paese?,0
873.jpg,8,2019-08-20,0,0,l'editoriale con corrado gabriele antonio menna leandro del gaudio gennaro matino barba&capelli radio crc targato italia tutti i giorni alle 9.10,0
874.jpg,0,2019-08-21,0,0,"un livello così basso che: ""certo molti di voi la taverna non se la meritano""! (carlotta m.)",0
875.jpg,36,2019-08-09,0,0,il kapitano si augura che gli italiano gli diano pieni poteri,0
876.jpg,24,2019-08-21,0,Salvini,chissà se oggi salvini indosserà la divisa da attaccato al cazzo.,0
877.jpg,20,2020-12-05,1,Salvini,è costato 49 milioni e nessuno si è lamentato,1
878.jpg,777,2019-08-29,1,Salvini,cosa ha fatto #salvini in questi mesi di governo,0
879.jpg,156,2019-08-20,0,"Renzi, Salvini","...intanto al funerale della democrazia... belin, levati quella solita faccia! disperatu un po' , altrimenti si capisce che l'abbiamo uccisa noi!",0
880.jpg,47,2019-08-28,1,Di Maio,piattaforma russò,1
881.jpg,63,2019-08-28,0,0,"salvini invita i leghisti a togliere il like alla pagina facebook di conte. cazzo, ma allora hanno davvero litigato! (badu) kotiomkin",0
882.jpg,9,2019-08-23,0,0,spinoza.it intanto mattarella aspetta al quirinale accarezzando il gatto.,0
883.jpg,160,2020-03-30,0,0,*orban ottiene i pieni poteri dal parlamento ungherese* intanto salvini: ogni italiano dovrà avere 7€,1
884.jpg,14,2019-08-20,1,"Conte, Salvini","conte obbliga salvini: fai sbarcare subito i ""minori""! geni! risultato: dopo lo sbarco già 8 su 27 si sono dichiarati maggiorenni"" sugli altri verificano...",0
885.jpg,39,2019-08-29,0,0,"invocare la piazza durante un comizio è prassi politica, farlo dall'aula di montecitorio dopo il colloquio col presidente della repubblica è un grave sgarbo istituzionale.",0
886.jpg,12,2019-08-09,0,"Zingaretti, Di Maio",finalmente un governo con i coglioni,1
887.jpg,18815,2019-08-28,0,"Zingaretti, Di Maio","""è giallo-rosso!"" ""no. è rosso-giallo!"" pd e m5s litigano sul colore del nuovo governo",1
888.jpg,21,2019-08-08,0,"Conte, Salvini",hoc voluerunt tav,0
889.jpg,34,2020-02-22,1,Salvini,sciacallo,1
890.jpg,58,2018-05-12,0,Lega,la lega a roma? cacamoje in testa! gabbiani de roma,1
891.jpg,54,2019-08-09,1,0,quando ti dicono che mentana sta preparando un'altra maratona televisiva di 48 ore no stop fisiologia e metabolismo di quest'uomo restano un enigma per la scienza,1
892.jpg,46,2019-08-13,0,Boschi,"giugno 2019 mai un alleanza con il m5s luglio 2019 mai con il m5s, sono uguali alla lega agosto 2019 superiamo le liti con il m5s, il paese ci sta più a cuore del pd settembre 2019 sarebbi io il nuovo capo del m5s",1
893.jpg,1682,2019-08-16,0,Salvini,intanto dimettiti,0
894.jpg,581,2019-08-20,0,Salvini,quando sali tutto convinto sulla tua ruspa per asfaltare i campi rom ma poi è conte che asfalta te,1
895.jpg,60,2019-08-19,0,Salvini,snap election salvini,0
896.jpg,93,2019-08-24,0,"Conte, Di Maio, Salvini",*la mia ragazza decide di non darmi più il culo* io: siamo al cospetto di una decisione oggettivamente grave che comporta conseguenze rilevanti,1
897.jpg,1354,2019-08-21,0,"Conte, Salvini, Di Maio",è istituzionalmente scorretto chiedere pieni poteri alla madonna per trasformare l'acqua in mojito,0
898.jpg,431,2019-08-08,0,0,non è proprio fame è più voglia di governo tecnico,1
899.jpg,9,2019-08-19,0,0,stop wasting time,0
900.jpg,117,2019-08-19,0,0,"cambio di strategia... salvini, passa da carnefice a vittima ""e adesso, andate via... voglio restare solo ... il paese ormai mi è avverso... dagli insulti, son sommerso...",0
901.jpg,0,2019-08-13,0,0,"#maratonamentana #crisidigoverno se #m5s e #pd volessero fare politica, una volta messe a tacere le rispettive tifoserie dato che #salvini sfiducia il governo (*), sostenendo che vi sia una sostanziale paralisi su temi qualificanti (per lui e per il...",0
902.jpg,67,2019-08-14,0,"Salvini, Di Maio","salvini dice sì al taglio dei parlamentari. giggino ... che, taglio?",0
903.jpg,14,2019-03-02,0,0,"per dindirindina, oggi ho dimenticato d'insultare salvini",1
904.jpg,26,2019-08-20,0,0,tweet vergine maria #immigratosmom salvini merda 04:32 20 aug 19 twitter for iparadise 333 retweets 333 likes,0
905.jpg,371,2019-08-20,0,"Conte, Salvini","conte si è dimesso al quirinale: mattarella avvierà le consultazioni domani alle 16 in aula attacco a salvini ""preoccupa chi chiede pieni poteri e invoca le piazze""",0
906.jpg,3969,2019-03-03,1,Zingaretti,big dick is back in town,1
907.jpg,521,2020-10-04,0,0,quando senti conte cazziare in diretta salvini e la meloni,1
908.jpg,97,2019-08-13,0,"Meloni, Berlusconi, Salvini",sono li da oltre 20 anni solo disastri per il paese anno 2011 lo spread a 528 gli italiani ricordano che monti e fornero sono arrivati perché il governo pdl-lega ci aveva portato sull'orlo del baratro?,1
909.jpg,3,2019-08-20,0,0,"meme dalla terza repubblica day 445 d.tr.: conte ha dichiarato che salirà al quirinale per presentare le dimissioni. signori grazie di tutto, continueremo.",0
910.jpg,94,2019-08-29,1,Salvini,quando sei salvini e ti sei auto-espulso dal governo e i pieni poteri? flat tax? porti chiusi? i marò? sacro cuore di maria? e bibbiano? c'è nessuno? francesca? almeno tu! v for voltù,1
911.jpg,952,2019-08-29,0,"Mattarella, Conte",mattarella conferisce l'incarico a giuseppe conte,0
912.jpg,19,2019-08-21,0,0,"basta inciuci o giochi di palazzo!!! l’italia ha bisogno di un governo stabile, elezioni subito!",0
913.jpg,18,2019-08-23,0,Salvini,era solo uno scherzo,0
914.jpg,13,2019-08-21,0,"Salvini, Di Maio",l'incubo gialloverde è finito,0
915.jpg,31,2019-03-09,0,0,"si, io voto salvini. s-tupide zecche. a-nnate a morì. l-egalizza sto ca'. v-iva gli italiani. i-forza capitano. n-ammazziamo i ne*. i-vivo ancora con mamma",1
916.jpg,8,2019-08-13,1,Salvini,culturama 13 agosto 2019 la crisi di governo apre all'apocalisse. la casa di carta sta per crollare? by leonardo pierri,0
917.jpg,36,2019-09-04,0,Salvini,"allegria di naufragi quindi è questo... perdere tutto per colpa di uno stronzo.. ma torno, ah se torno",0
918.jpg,63,2019-09-02,1,Zingaretti,"liberali ""un momento che lo annoto sulla mia macchina da scrivere invisibile""",1
919.jpg,127,2019-01-23,0,Salvini,"da una parte un ladro che vive a spese degli italiani, è violento ed arretrato. dall'altra un ragazzo di colore",1
920.jpg,4,2019-08-27,0,"Zingaretti, Di Maio","il manifesto fate la cosa giusta più vicina la possibilità di un governo m5s-pd ma i problemi restano, in primo luogo quello di persona capaci di interpretare la svolta per un governo ""non purchessia"". zingaretti ""ottimista"". il colle riapre le consultazioni. salvini nell'angolo: ""ribaltone"". berlusconi: ""un governo di ultrasinistra""",0
921.jpg,2402,2019-08-20,0,0,quando hai l'interrogazione di geografia sull'italia ma conte si è dimesso il 20 agosto: non so neanche chi è il presidente,1
922.jpg,31,2019-04-07,0,PD,pd partito democratico ,1
923.jpg,66,2019-08-16,0,Salvini,"8 agosto 2019 inutile andare avanti, si restituisca la parola agli elettori. 15 agosto 2019 non ho mai detto di voler staccare la spina al governo. #valetutto",0
924.jpg,28,2019-08-09,0,0,fino a qui tutto bene.,0
925.jpg,5,2019-05-08,0,Salvini,chi nasconde un ebreo è contro il popolo tedesco. chi aiuta un immigrato è contro il popolo italiano,1
926.jpg,13,2019-08-29,0,0,da quando avete deciso che scendere in piazza è eversivo?,0
927.jpg,53,2019-08-13,1,0,"panorama by la verità abbiamo davvero bisogno del parlamento? meglio distruggerlo? ecco alcune proposto del nostro ideologo luca telese: ""dai, ora basta fantasticare. meglio riposare, il fascismo non si restaurerà da solo"" ""fallo!"" ""distruggilo!"" ""realizza ciò che devi!"" ""trasformalo in qualcosa di nuovo!"" *voices whispering in the night*",1
928.jpg,144,2020-04-27,1,Salvini,ha una dignità? sì,1
929.jpg,9,2019-08-10,0,0,#lanottedei5stellecadenti satira cruda,0
930.jpg,83,2019-08-10,1,Di Maio,"retromarcia sulla tav decreto sicurezza bis regalare il governo a salvini ""abbiamo abolito la povertà, danilo!""",1
931.jpg,3,2019-08-15,0,0,feriae augusti... istituita dall'imperatore augusto e riportata in auge nel ventennio fascista... ps non ditelo all'on. d'alessandro... potrebbe proporre la cancellazione di questa festa nazionale,0
932.jpg,16,2019-08-27,0,0,tg2 giornata del 26/8 edizione delle 20:30,0
933.jpg,6,2019-12-08,0,0,"l'ho già scritto salvini merda oggi? sì, l'ho già scritto.",1
934.jpg,425,2019-09-09,0,Salvini,politica salvini chiede pieni poderi e una nonna calabrese lo manda a raccogliere i sciurilli nell'orto lo statale jonico,1
935.jpg,1613,2019-08-10,1,"Di Maio, Salvini",filippo confidiamo in te,1
936.jpg,9,2019-08-13,0,0,partito democratico incontri divini nel borgo antico,0
937.jpg,8,2019-08-13,0,0,"estrazione superenalotto, il 6 dei record a lodi: vinti 209 milioni con una schedina casuale da 2 euro",0
938.jpg,140,2020-04-20,0,"Salvini, Conte","prima della sega, dopo la sega",1
939.jpg,562,2019-08-17,0,Salvini,non ho mai detto di non voler lavorare documenti importanti papeete ministero dell'interno,0
940.jpg,322,2019-09-02,0,0,conte ha affermato che il nuovo governo non farà cose stratosferiche. sarà un anno quasi grazioso.,0
941.jpg,120,2019-08-20,0,0,di maio: da bibbitaro a sommelier per il pd è stato n'attimo.,0
942.jpg,4,2019-08-11,0,0,"**letteralmente tutto l'anno** ""il pd ha intenzione di allearsi col m5s?"" renzi no",1
943.jpg,694,2019-08-18,1,"Di Maio, Salvini",chiudi maria,1
944.jpg,69,2019-08-25,1,Mattarella,continuano le consultazioni di mattarella ...,1
945.jpg,29,2019-09-03,0,0,"""amma fa l'alleanza!"" ""primm' sentimm che dice russò""",1
946.jpg,23,2019-08-25,0,Mattarella,mattarella attende la delegazione della lega,0
947.jpg,325,2019-08-21,0,0,salvini quando ha annunciato la crisi di governo alleanza m5s-pd discorso di conte democrazia parlamentare,1
948.jpg,257,2019-09-04,0,Del Rio,"dobbiamo restituire fiducia agli italiani. meno promesse, più fatti.",0
949.jpg,17,2019-08-27,0,Conte,let's do it giuseppi!,0
950.jpg,22,2019-08-19,1,"Salvini, Conte","marescià gli tolgo la benda per fargli vedere cosa succede al governo? ma si, un po' di tortura anche lui se la merita",1
951.jpg,44,2019-08-20,0,"Conte, Di Maio, Salvini, Tria","""vabbe va, soo semo visto.."" facebook.com/ermejopapaderoma",1
952.jpg,19,2019-08-10,0,0,"lorenzo, per quest'anno siamo sicuri di veder cadere almeno 5 stelle #movimento5stelle",0
953.jpg,49,2019-09-03,0,0,"m5s ha chiesto un parere agli iscritti, salvini mica ha chiesto ai suoi se erano d'accordo a far cadere il governo!",0
954.jpg,107,2019-08-11,1,Zingaretti,no matteo non sono d'accordo adesso chiamo il ceo del comunismo,1
955.jpg,85,2019-08-22,0,0,io con la crisi di governo io senza la crisi di governo io con le nuove elezioni io con il reddito di citadinanza orcozio,1
956.jpg,53,2019-08-23,1,Salvini,per il cuore immacolato di mari-- mammt',1
957.jpg,9,2019-08-30,0,0,have like a bombei,0
958.jpg,476,2019-08-20,0,"Conte, Salvini","""con le interferenze sui ministri hai minato l'azione di governo. in coincidenza dei più importanti consigli europei non sei riuscito a contenere la foga comunicativa creando un controcanto politico che ha generato confusione"". per farla breve, si un ciessu!",1
959.jpg,13,2019-08-31,0,0,"giocal sergio staino mi creda, ho sempre giudicato i grillini la gente più stupida e dannosa che potessimo avere in italia. e lo penso ancora. ciononostante sono contento di provare a fare un governo con loro. e cosa vuole da me? sapere se sono rimbecillito del tutto o molto maturato politicamente.",0
960.jpg,1834,2020-11-02,0,Renzi,piddinacci schifosi piddinacci ahahahahahah piddinacci ahahahahahahahahah,1
961.jpg,55,2019-08-20,0,Conte,...però arriva il momento in cui dici: abbasta!,1
962.jpg,7,2019-08-31,1,0,nonna dove vai? a montecitorio...,1
963.jpg,17,2019-08-19,0,Grillo,...e allora il pd,1
964.jpg,69,2019-02-15,0,0,"male, female, white, black, rich, poor, gay, straight, elettore medio di salvini",1
965.jpg,74,2019-08-20,0,Conte,boom,0
966.jpg,10,2019-08-21,0,"Salvini, Conte","""irresponsabile ignorante e codardo"" conte al vice salvini: ""interessi personali contro l'italia, appelli preoccupanti alla piazza, nessun chiarimento sulla russia, neppure il coraggio di sfiduciarmi. ma ci penso io"". e va a dimettersi",0
967.jpg,8,2019-08-17,0,0,"crisi di governo, emanuele filiberto: ""gli italiani mi chiamano"" - quotidianonet",0
968.jpg,80,2020-04-23,0,Salvini,se il 2020 fosse un coglione,1
969.jpg,6,2019-09-01,0,0,sarei una repubblica fondata sul lavoro. non sulla logorrea koko,0
970.jpg,53,2019-08-21,0,0,quando arriva la parte dove lui tenta la fuga travestito da soldato tedesco?,0
971.jpg,46,2019-08-10,0,0,"carlo sibilia buongiorno amici! stamattina cancelliamo un po' di luoghi comuni sulla situazione del governo. 1. ""il governo è in crisi"": no. questo lo sostiene il pd e il centrodestra orfano di poltrone con media e giornali di partito al seguito. credo di aver letto questa frase ogni giorno nell'ultimo anno. eppure abbiamo fatto reddito di cittadinanza, quota 100, spazzacorrotti e raggiunto gli obiettivi fissati. noi non vogliamo litigare ma portare a casa un sostanzioso taglio delle tasse in manovra. vogliamo tutti le stesse cose. dal m5s non vedrete litigi, ma serietà. no litigi e no crisi.",0
972.jpg,5,2019-08-23,0,Salvini,"vi prego, mi vestirò bene, verrò tutti i giorni in ufficio, quello che vi pare... ripigliatemi! a casa non ci posso tornà. giorgetti ha cambiato la serratura! il pd beve, lo sapete che beve? e poi ve mena... calma, dignità e classe",0
973.jpg,45,2019-08-25,0,0,crisi di governo la vergine maria è passata dalla modalità cuore immacolato a fegato ingrossato,0
