377.jpg,643,2019-08-21,1,"Di Maio, Salvini",and now the time has come for you to lip synch your legacyyy,1
378.jpg,674,2019-08-27,0,Meloni,"chef rubio @rubio_chef 4h ""il reato di tortura impedisce agli agenti di fare il proprio lavoro"" ipse dixit 5 nessun individuo potrà essere sottoposto a tortura o a trattamento o a punizioni crudeli inumani o degradanti la polemica meloni ""il reato di tortura impedisce agli agenti di fare il proprio lavoro"" poi cancella il tweet",0
379.jpg,59,2019-09-03,0,0,"siamo in attesa dei risultati della votazione su #rousseau, conclusa alle 18 #crisidigoverno",1
380.jpg,2,2019-08-29,0,0,"""ve mancamo eh..""",1
381.jpg,244,2019-09-04,0,0,piermatteo griesco amministratore adesso salvini crea il decreto sicurezza bis si forma il governo pd-5s manifestanti leghisti scendono in piazza a far casino manifestanti leghisti vengono manganellati dalla polizia a causa del decreto sicurezza bis,0
382.jpg,5,2019-08-21,0,"Conte, Salvini","crisi di governo, nicola morra a salvini: ""il rosario in calabria è un messaggio in codice alla 'ndrangheta"" il senatore m5s è intervenuto in senato sul tema dei simboli religiosi usati da salvini per scopri politici",0
383.jpg,19,2019-08-23,0,"Zingaretti, Mattarella","salve presidente, il fratello di montalbano sono!",1
384.jpg,19,2019-08-11,0,0,italiani vi aspettiamo alle urne taffo funeral services,1
385.jpg,106,2019-08-21,0,0,"il ""capitano"" si scaglia su bibbiano ... ma con un governo intatto, avremmo avuto la commissione d'inchiesta sul caso cambia propaganda giù le mani dai bambini",0
386.jpg,8,2019-08-28,1,Salvini,e lasciami gridare...,1
387.jpg,302,2017-05-11,1,Berlusconi,wish you were here,1
388.jpg,135,2019-08-26,0,Salvini,domani ricominciano le consultazioni e io non so ancora che rosario mettermi.,1
389.jpg,29,2019-08-29,0,0,usa nel tuo turno lo imperatore,0
390.jpg,1137,2019-08-21,0,0,professore quando all'orale mi affido ad entità religiose invece di rispondere: se ne vada,1
391.jpg,31,2019-08-21,1,"Di Maio, Salvini",ignora ignora,0
392.jpg,397,2019-08-28,0,Salvini,"roba da matti un tizio, che da ministro degli interni firma una legge, che limita il diritto di manifestare, invita a scendere in piazza contro un governo che potrebbe formarsi, dopo aver fatto saltare il suo stesso governo per aver chiesto le dimissioni del suo presidente... ah no è salvini",1
393.jpg,1803,2019-09-04,1,0,pensi sia giusto studiare c senza puntatori? si no,1
394.jpg,3,2019-08-23,0,0,partito socialista italiano,0
395.jpg,10,2019-08-28,1,"Salvini, Di Maio, Zingaretti",la peperonata,1
396.jpg,9,2019-08-20,0,0,"""crisi di governo"" ""lo stesso esilarante senso di disperazione dei migliori film di sam raimi"" -bloody disgusting",1
397.jpg,234,2019-08-20,0,"Conte, M5S",gianmauro dell'olio m5s senato comunicazioni del presidente del consiglio dell'aula,0
398.jpg,21,2019-09-03,0,0,"fossi in renzi farei un nuovo partito e lo chiamerei j fox tanto per sentire salvini tra 5 anni dire mai col j fox, mai col j fox almeno mi ricorda ritorno al futuro",0
399.jpg,25,2019-08-07,0,Conte,dadaumpa #lepiubellefrasidiosho,1
400.jpg,16,2019-08-09,0,"Di Maio, Conte, Salvini",hanno messo l’italia in ginocchio e ora scappano per paura della legge di bilancio. mandiamoli a casa!,0
401.jpg,5,2019-08-22,0,0,"corriere della sera roma login il retroscena 21 agosto 2019 23:54 parte la trattativa pd-m5s, spunta l'ipotesi della prima donna a palazzo chigi",0
402.jpg,1,2019-08-20,0,0,cadde.,0
403.jpg,285,2018-08-10,0,0,"esistono degli esseri, detti pdioti, che ancora ritengono che salvini sbagli a chiudere porti e aeroporti",1
404.jpg,655,2019-08-21,0,Salvini,"questo è lo staff comunicazione di salvini - conosciuto come ""la bestia"" da oggi non li paghiamo più noi anche loro sloggiano dal viminale la zecca buonista",0
405.jpg,2873,2019-08-20,0,"Conte, Di Maio, Salvini","conte rassegna le dimissioni, 5 secondi di penalità per vettel e 5 secondi anche per hamilton",1
406.jpg,22,2019-08-20,0,Salvini,"luigi, ascoltami bene! ti concedo un'ultima possibilità: tu fai il premier e io mi metto anche una scopa in culo così ti ramazzo la stanza. e se non ti sta bene passo anche al partito democratico! prendere o lasciare?",0
407.jpg,166,2019-08-28,0,0,tra un paio di settimane dovrò subire una colonscopia. negli stessi giorni vedrò nascere un governo tra pd e m5s. i due eventi suscitano in me lo stesso entusiasmo,0
408.jpg,36,2019-08-19,0,0,"parla salvini ""meglio finire in galera che governati dal pd""",0
409.jpg,14,2019-08-28,0,Meloni,"gruppi ""fratelli d'italia"" del senato del e della camera",0
410.jpg,15,2019-08-20,1,Salvini,#capitanconiglio,1
411.jpg,90,2019-08-10,0,0,ultim'ora salvini ottiene pieni poteri e li mangia a colazione. turismo-viaggiare sicuri,1
412.jpg,108,2019-08-18,0,Conte,giuseppe conte è il mio presidente!,0
413.jpg,13,2019-08-29,0,0,"ha vinto il pd, ha perso il populismo",0
414.jpg,2972,2019-08-09,0,0,e domani tutti al papeete per l'apericrisi!,0
415.jpg,6,2019-08-21,0,"Salvini, Conte","""me manna puccio""",1
416.jpg,636,2019-08-29,0,0,"fabrizio delprete2 @fdelprete2 +++ansa+++ indagato nuovamente per sequestro di persona, trovato #salvini in fuga al confine con la svizzera travestito da wurstel tedesco. #salviniacasa 19:40 29/08/19 twitter for iphone",0
417.jpg,807,2019-08-30,0,0,vigili del fuoco,0
418.jpg,176,2019-08-21,1,Salvini,capovolgimenti di fronte: adesso è il rosario che bacia salvini!!! panico a verona.,1
419.jpg,11,2019-08-11,0,Salvini,adesso aspettatevi: eliminazione del concorso nazionale nelle specializzazioni. sì al numero aperto a medicina. grazie a salvini,0
420.jpg,3,2019-08-10,0,0,pd: la decisione da prendere è dentro di te! ed è... sbajata!,1
421.jpg,51,2019-08-16,1,Salvini,"jocker o due-facce? le pagliacciate portano l'italia in recessione 8 agosto inutile andare avanti, si restituisca la parola agli elettori 15 agosto non ho mai detto di voler staccare le spina al governo gd giovani democratici chieri noi non ci stiamo!",1
422.jpg,221,2020-04-29,0,Lega,sai la storia che usiamo solo il 20% del nostro cervello? con questa lo utilizzerai solo il 2%,1
423.jpg,22,2019-08-26,0,0,lettera43 fenomenologia della maratona mentana. speciale televisivo con fan sul web. quasi una sit-com. tra personaggi fissi e angherie agli inviati. la sociologa bentivegna e l'ideatore delle pagine social mercadante spiegano il successo del format.,0
424.jpg,8,2019-08-20,1,Salvini,vendesi ruspa usata solo per servizi fotografici chiamare lido papeete e chiedere di matteo,1
425.jpg,200,2019-08-21,0,"Salvini, Conte, Di Maio",oh comunque po' sentimn pe nu cafè,1
426.jpg,8,2019-08-12,0,0,per risolvere l'attuale crisi politica sostieni anche tu il governo di scopo,1
427.jpg,5,2019-08-25,0,0,"andamento rialzista o illusione di un rialzo? ftsemib, 1w",0
428.jpg,83,2019-08-17,0,Mattarella,"quando hai già prenotato, sdraio e ombrellone a mondello e ti fanno più di dieci giorni di crisi di governo",1
429.jpg,22,2015-10-28,0,0,"quando ho chiesto un ""toscano"" mi riferivo a un sigaro non ad un cazzaro. renzi sbarca a cuba",1
430.jpg,2978,2018-12-31,0,Mattarella,ma porco di,1
431.jpg,3,2019-08-09,0,0,"è crisi di governo: spread vola borsa italiana affonda. le conseguenze. la crisi agita i mercati: lo spread sale a 236 punti. piazza affari apre a -1,62% salvini apre crisi di governo, tensione sui mercati la crisi di governo fa paura, lo spread vola oltre quota 230 punti",0
432.jpg,11,2019-08-09,0,0,"""governo del cambiamento di cinque anni"" vediamo un po chi si nasconde qui sotto governo instabile che non arriva a fine legislatura e che fa debito",1
433.jpg,6,2019-08-22,1,"Berlusconi, Salvini",dopo...dopo! voglio pieni poteri e un rosario gigante,1
434.jpg,697,2018-05-29,0,"Di Maio, Mattarella","presidente? cosa vuoi, alternativo dei miei coglioni che quando io ascoltavo i dead kennedys tu nemmeno ti facevi le pippe",1
435.jpg,127,2019-09-05,1,Salvini,un film di dario argento profondo rousseau,1
436.jpg,141,2019-03-08,0,Salvini,la tua ignoranza è il mio stipendio,1
437.jpg,17,2019-06-07,0,Conte,"""te sei cacato sotto eh?"" ""eh, 'n pochetto""",1
438.jpg,36,2019-08-11,0,0,"la stampa marzo 2018 grillo benedice il patto m5s-lega: ""di salvini ci si può fidare"" la stampa svolta di grillo: sì al fronte anti-salvini. e apre alla deroga sul terzo mandato",0
439.jpg,17,2019-08-28,0,0,segui la programmazione di la7 in diretta streaming,0
440.jpg,34,2019-09-04,0,"Conte, Mattarella",tranquillo presidente! non sono samara... sono io!... conte bis! www.brunoolivieri.com,0
441.jpg,18,2020-10-04,0,Salvini,che figura di merda,1
442.jpg,23,2019-09-15,0,"Grillo, Renzi",vaffanculo day. vendoilculo day,1
443.jpg,36,2019-08-20,0,0,elettori della lega: esattamente quando avete chiesto a salvini di sfiduciare il presidente conte? salvini dice che lo avete chiesto voi. prendetevi la vostra responsabilità.,0
444.jpg,5,2019-04-24,1,Salvini,balla di lardo,1
445.jpg,101,2019-08-20,0,"Salvini, Conte",e mò tu che vuoi? mi dovrei dimettere presidente. che tempismo di merda che c'avete oh... mi ero appena addormentato. ma sò le nove. ma fatti i cazzi tuoi.,0
446.jpg,13,2019-02-24,0,0,legaioli! andate tutti quanti affanculo!,1
447.jpg,3,2019-08-26,0,"Zingaretti, Renzi",chi t'ha dato 'sto fumo? dibba dar guatemala.. m'hai convinto..,1
448.jpg,2902,2019-08-21,0,"Di Maio, Salvini, Conte","""signor salvini mi parli del nervo trigemino"" oh merda se parlo di quello mi sputtano, parlo di altro tanto nessuno se ne accorge",1
449.jpg,29,2019-08-20,0,Conte,vangelo secondo giuseppe,0
450.jpg,11,2019-08-25,0,Mattarella,mattarella riceve la delegazione del pd paf! paf! sbam!,0
451.jpg,43,2019-08-09,0,"Di Maio, Salvini",siamo pronti a dare battaglia,0
452.jpg,13,2019-08-11,0,Salvini,nessun aumento dell'iva cercano di spaventarvi perché sono attaccati alla poltrona ma c'è tutto il tempo per votare e fare la manovra economica,0
453.jpg,48,2019-03-28,0,0,"""matteo, prova a fare una delle tue estronsate de pazzo, prova a tirare fuori el ferro... io te lo estrapo de mano, te lo metto en el culo e poi premo el grilletto hasta che siento el clic""",1
454.jpg,5,2019-08-20,0,"Conte, Salvini","crisi di governo, conte al senato: ""il governo finisce qui, darò le dimissioni al presidente mattarella. salvini ha eseguito interessi personali e di partito""",0
455.jpg,4397,2019-08-12,1,"Di Maio, Renzi, Mattarella","facci cognoscer lo tuo pensier: qual est lo miglior avvenire per lo paese? a allo voto subito, b alleanza/accrocchio di scopo fra inimici, c governo del presidente, d invasione dei lanzichenecchi con pestilenza al seguito",1
456.jpg,33,2019-08-28,0,"Zingaretti, Di Maio",primopiano accordo per conte premier domani convocato al colle,0
457.jpg,22,2019-08-20,0,0,"alla lega: davvero salvini, è il migliore candidato che avete, per fare cose che servono a tutti gli italiani, come ministro? ... interessante...",0
458.jpg,111,2019-08-22,0,Salvini,quando forse ti è venuto il primo esercizio della giornata e sono le 19:00,1
459.jpg,11,2019-09-03,0,0,stasera italia stasera italia #crisidigoverno,0
460.jpg,14,2019-09-04,0,Di Maio,dopo il voto su rousseau è ufficiale al governo col pd. i grillini la prendono bene bibbiano... honesti... eallorailpd...,0
461.jpg,0,2019-08-24,0,Zingaretti,possiamo trovare un accordo: io gambizzo renzi se seppellite dibba che ci sputtana con la corruzione,0
462.jpg,433,2018-09-02,1,Di Maio,space x: le sorprendenti immagini del manichino alla guida della prima auto lanciata nello spazio,1
463.jpg,24,2019-08-21,0,0,ti hanno mai parlato di darth plagueis il saggio? era un signore dei sith talmente potente da poter indurre i midiclorian a far cadere i governi,1
464.jpg,142,2019-08-20,1,"Salvini, Conte, Di Maio","io ad agosto stavo qua a lavorare, tu dov'eri?!",1
465.jpg,87,2019-07-05,1,Di Maio,questa lega è una vergogna,1
466.jpg,10,2019-08-31,0,0,tg 2 giornata del 30 agosto edizione delle 20:30,0
467.jpg,520,2019-10-10,0,"Di Maio, Conte","non sono professionisti, sono presi dalla strada",1
468.jpg,426,2019-08-17,1,Salvini,"cinque minuti, potresti fare il ministro dell'interno... ...per cinque minuti?",1
469.jpg,41,2019-10-01,0,0,ogni singolo pensiero di salvini,1
470.jpg,32,2019-08-29,0,"Zingaretti, Di Maio, Salvini","basta litigare! prendetevi un suv, c'è posto per tutti. #cercasiscambisti popmove",1
471.jpg,34,2019-08-22,0,0,italian crisis,1
472.jpg,59,2019-08-26,0,0,pd di maio lega,1
473.jpg,5,2019-08-09,1,Salvini,la parola torna agli italiani io ho fiducia nel mio capitano,0
474.jpg,473,2019-08-28,0,Salvini,"tutti quanti dicono ""salvini razzista"" ""salvini fascista"" ""salvini troglodita"" ma nessuno dice mai come stai salvini ?",1
475.jpg,133,2019-08-30,0,0,quanto dovrebbe durare il governo pd-m5s? 1 mese 3 mesi 5 anni,1
476.jpg,16,2019-09-01,0,0,"satira cruda +++ orban scrive a salvini, non ti dimenticheremo. sei stato il primo a voler fermare i migranti. +++ vero, il primo razzista non si scorda mai! antonio lacarbonara",0
477.jpg,25,2019-08-11,0,0,la nascita del nuovo governo pd-m5s diffonde fiducia,0
478.jpg,36,2019-09-05,0,0,"orietta berti: ""io, lenin e di maio""",0
479.jpg,6,2019-09-03,1,Di Maio,e la luna rousseau,1
480.jpg,17,2019-08-28,1,Conte,rings 2 il ritorno del conte,1
481.jpg,178,2019-04-10,0,0,"ti prego,ripetilo ancora. salvini merda",1
482.jpg,3,2019-08-20,0,0,spoiler alert!,0
483.jpg,40,2019-08-15,0,Civati,"la crisi ambientale è più grave della crisi politica, e una politica in perenne crisi non ce la possiamo permettere. serve un esecutivo che metta in campo misure serie per il contrasto del cambiamento climatico e serve ora perché non c'è più tempo",0
484.jpg,0,2019-08-11,0,0,renzi: ora un governo salva conti e grillo si schiera contro il voto,0
485.jpg,258,2019-07-19,0,"Salvini, Adinolfi, Meloni","""i neri sono inferiori ai bianchi"" matteo salvini ""le donne sono inferiori agli uomini"" mario adinolfi ""i gay sono inferiori agli etero"" giorgia meloni ma gli idioti sono tutti uguali!",1
486.jpg,108,2019-08-19,0,0,conte in senato cosa succederà domani? @italiatrepuntozero,0
487.jpg,24,2019-08-28,0,"Mattarella, Zingaretti, Salvini, Di Maio",seconda giornata di consultazioni pd e 5stelle confermano l'accordo politico matteo salvini attacca il pd e non chiude ancora la porta ai vecchi alleati,0
488.jpg,445,2019-08-20,0,Mattarella,ma mò 'o vulisseno da me 'a vermut?,1
489.jpg,320,2019-08-27,0,Conte,"forza conte fermiamo i cambiamenti climatici, proteggiamo la biodiversità e sconfiggiamo le diseguaglianze",0
490.jpg,307,2019-08-09,0,Casalino,minchia! adesso chi lo dice a casalino che si è giocato il ferragosto anche quest'anno?,1
491.jpg,163,2019-08-25,1,"Salvini, Di Maio, Zingaretti",pnd,1
492.jpg,179,2019-08-28,0,0,e chi lo dice a salvini che questo è un tunisino??,1
493.jpg,388,2019-09-01,0,"Salvini, Mattarella","c'era il 3x2 sugli abiti uomo da oviesse, eh...?",1
494.jpg,52,2019-09-01,0,0,"quando qualcuno dice ""un altro governo non eletto dal popolo!""",1
495.jpg,360,2019-08-21,1,Mattarella,architrash vs fight!,1
496.jpg,30,2019-08-14,0,0,"mi chiedo come faccia un ministro della repubblica italiana ad evitare i processi e citare borsellino, dire di amare il proprio paese e decidere di lanciarlo verso la crisi economica.",0
497.jpg,785,2019-09-04,0,"Conte, Di Maio",mo' ripassa le capitali,0
498.jpg,99,2020-01-22,0,Salvini,buongiorno/buonasera ci hanno detto che da lei c'è un coglione. ci può far entrare cortesemente? salvini,1
499.jpg,17,2019-08-21,0,"Conte, Salvini",lo sai chi ti saluta? no. chi?,1
500.jpg,2443,2018-09-27,0,PD,"hey, pd knock once if you really are di sinistra",1
501.jpg,20,2019-08-14,0,0,"""canà, tagliamo i parlamentari!"" ""...fra 5 anni"".",1
502.jpg,3,2019-08-14,1,0,intitolata a salvini in questo ministero lavorò matteo salvini capitano di sventura 15 agosto 2019 la sala giochi del viminale,1
503.jpg,1065,2018-09-08,1,D'Alema,"oh hey john! speak of the devil! did somebody speak of me??? n-no massimo, it's just a figure of speech... oh. y'know, i get lonely fuori dal parlamento",1
504.jpg,3,2019-08-03,0,0,"così gigino torna a casa, la sete qua si fa sentire.....",0
505.jpg,4,2019-08-31,0,0,"sisa supermercati italiani galbani mortadella augustissima (all'etto) 0,59",0
506.jpg,58,2019-08-22,1,"Zingaretti, Renzi",crisi di governo il pd apre i primi confronti interni.,1
507.jpg,456,2019-08-14,1,0,1 sergio mattarella 2 sergio mattarella 3 sergio mattarella 4 sergio mattarella 5 sergio mattarella 6 sergio mattarella 7 sergio mattarella 8 sergio mattarella 9 sergio mattarella 10 sergio mattarella,1
508.jpg,15,2019-08-20,0,0,la fraschetta del nonno,0
509.jpg,1,2019-08-21,0,"Conte, Mattarella","""so venuto a rimette er mandato"" ""ma te sei magnato qualcosa che t'ha fatto male?""",1
510.jpg,140,2019-08-22,0,0,"""quindi adesso la scorta adesso la tolgono a lui..."" @zenocataway",0
511.jpg,39,2019-08-30,0,Salvini,"buongiorno signora, le interessa un governo verdefascio?",0
512.jpg,168,2019-08-24,0,0,"viaggiatore nel tempo: in che anno siamo? io: 2019, siamo nel pieno della crisi di governo viaggiatore: ah, prima che venga fatto un governo pd-m5s con fico presidente del consiglio che verrà ricordato come il governo peggiore del 21° secolo io:",1
513.jpg,16,2019-08-16,1,"Salvini, Di Maio",le due foto che hanno commosso il web,1
514.jpg,79,2019-08-28,0,Conte,"chi è? conte! ancora? eh, sì... i conti tornano! ah, ah, ah... ma come mi vengono?! oh, santa rosalia!",0
515.jpg,61,2019-08-09,1,Salvini,game of polthrones,1
516.jpg,14,2019-08-09,0,0,"c'è chi comprende e chi non comprende, caro signore. sta molto peggio chi comprende, perché alla fine si ritrova senza energia e senza volontà. luigi pirandello",0
517.jpg,96,2019-08-20,0,0,climate is changing... why aren't we?,0
518.jpg,30,2019-08-23,0,0,salvini apre a di maio premier di maio:,1
519.jpg,6,2019-09-06,0,Salvini,"lo stolto guarda il dito. tu sei il potere, vuoi essere assolto o condannato?",1
520.jpg,41,2016-06-16,1,0,dedicato a tutti i comunisti,1
521.jpg,57,2019-08-20,0,0,"rai 3 conte e a capo film big wedding questa sera ore 21:25 crisi di governo, oggi il premier conte in senato 09:50",0
522.jpg,98,2019-08-21,0,"Conte, Salvini","film: cane e gatto italia/usa: 1983 genere:commedia è la storia di un ""playboy"" e ""ladruncolo da strapazzo"", che viene ""ridimensionato drasticamente"" da un uomo per bene.",1
523.jpg,49,2019-09-11,1,"Conte, Meloni",oops!,1
524.jpg,80,2019-08-12,0,0,un desiderio l'ultimo... una stella cadente... una legislatura che duri 5 anni,1
525.jpg,11,2019-08-28,0,Di Maio,possibili scenari politici che ne dite voi dei 5 stelle di fare un'alleanza con noi dell'isis? possiamo valutare...quanti voti avete?,0
526.jpg,2,2019-08-28,0,0,vogliamo un governo paritario composto da donne e uomini al 50% questa è discontinuità!,0
527.jpg,12,2019-08-28,1,D'Uva,el professor,1
528.jpg,108,2019-09-01,0,Mattarella,"finge di rimanere chiuso in ascensore per sfuggire alle consultazioni sms del papa: ""te lo dicevo che non avrebbe funzionato""",1
529.jpg,91,2019-01-28,0,0,"man, woman, white, black, poor, rich, asian, le pagine pro lega",1
530.jpg,35,2019-08-21,0,0,"marco nazzareno filipponi #crisidigoverno in breve: dopo 14 mesi da presidente del consiglio, #conte ha aperto facebook. translate tweet 11:19 21/08/2019 from porto sant'elpidio, marche twitter f...",0
531.jpg,903,2019-08-29,0,Salvini,"matteo salvini @matteosalvinimi un governicchio fondato unicamente sulle poltrone e sull'odio non ha vita lunga. per loro prima le poltrone, per noi ora e sempre #primagliitaliani! fabrizio delprete in risposta a @matteosalvinimi ""un governicchio fondato unicamente sulle poltrone e sull'odio (il tuo) non ha vita lunga"". infatti è caduto dopo 15 mesi.",0
532.jpg,233,2019-08-23,1,"Conte, Di Maio",-chi ha responsabilità di governo dovrebbe evitare di accostare nei comizi slogan con simboli religio-,1
533.jpg,5,2019-08-10,1,"Salvini, Di Maio",la guerra che nessuno vuole inspired by true events fernando farina,1
534.jpg,72,2019-08-26,1,"Renzi, Conte",#primalepoltrone,1
535.jpg,225,2019-08-22,1,"Di Maio, Zingaretti, Mattarella","-stamo un po' in crisi. -è tutto il paese che è in crisi, mannaggia alla miseria.",1
536.jpg,177,2019-08-29,0,0,pd+5s = + tasse,0
537.jpg,10,2019-08-22,0,0,"ci scusiamo per il disagio, ma il governo era già morto prima di nascere. il funerale non verrà celebrato. #crisidigoverno",0
538.jpg,155,2019-08-19,0,Salvini,san cazzaro da milano,1
539.jpg,166,2019-08-09,0,0,ora è dura far rientrare il popcorn nella pannocchia www.ilfirmamento.com,0
540.jpg,196,2019-08-30,0,0,vergogna il potere sulla pelle dell'innocenza,0
541.jpg,42,2019-08-13,0,Salvini,anche a me diceva di durare 5 anni,1
542.jpg,69,2019-08-17,0,Renzi,dicono sia bello il remake di sabrina vita da strega,1
543.jpg,13,2019-09-02,0,0,lunedì 2 settembre ore 19 rainews24,0
544.jpg,175,2019-08-09,0,0,salvini: beh credo proprio di dover aver pieni poteri in questa situaz- mattarella: you dare oppose me communist,1
545.jpg,279,2019-08-22,0,0,"pd, movimento 5 stelle, lega",1
546.jpg,203,2019-08-20,0,0,types of headaches migraine hypertension stress following italian government crisis,1
547.jpg,16,2020-04-25,0,"Renzi, Berlusconi, Napolitano, Monti, Prodi",la bocca si apre in fretta… il cervello ha fatto tardi…,1
548.jpg,29,2019-08-19,0,0,"articolo 92 il governo della repubblica è composto del presidente del consiglio e dei ministri, che costituiscono insieme il consiglio dei ministri. il presidente della repubblica nomina il presidente del consiglio dei ministri e, su proposta di questo, i ministri.",0
549.jpg,305,2019-08-08,0,Conte,e se cade er governo? ma anche sti cazzi! ormai c'ho 'n curriculum da paura!,1
550.jpg,98,2019-09-03,0,0,"salvini, invidioso, vuole una piattaforma per la lega: la piattaforma ruttò.",0
551.jpg,10,2019-08-09,0,Salvini,"ciao sergio, me sa che se dovemo vedè ma io domani c'ho un impegno in spiaggia a polignano, come la vedi se ti mando una moto d'acqua della polizia che te porta da me? daiii... è 'na volata, se voi do disposizioni e te fanno guida a te.... è divertente 'na cifra... ok allora è ita, a domani. ah, porta il costume...",1
552.jpg,1725,2019-08-19,0,0,"al voto subito il governo è finito. aspettate forse si possono tagliare i parlamentari e poi votare. corro da solo però silvio è vecchio. no dai silvio facciamo le elezioni assieme ti prego. però il voto non è così urgente eh. non mi dimetto, non darò questa soddisfazione a nessuno. voto cosa?",1
553.jpg,262,2019-08-22,1,Di Maio,quasi quasi a sto giro non la apriamo.,1
554.jpg,34,2019-08-26,0,"Zingaretti, Di Maio",la trattativa... falsi disonesti scappati di casa bibbitaro mai con renzi bibbiano schifosi corrotti vaffa peppafè,0
555.jpg,520,2019-05-13,1,Salvini,"che cucciolo. si chiama matteo salvini. posso accarezzarlo? certo, abbaia soltanto",1
556.jpg,69,2020-01-24,0,Salvini,"""scusi, lei spaccia?"" ""a spaccimm e chitemmuort!""",1
557.jpg,78,2019-08-28,1,Mattarella,"attendi il mio arrivo, alla prima luce del quinto giorno di consultazioni all'alba guarda ad est gandalf!",1
558.jpg,12,2019-08-23,1,Mattarella,inizio delle consultazioni con i gruppi parlamentari.,1
559.jpg,1,2019-08-24,0,"Di maio, Renzi",taglio dei parlamentari parliamone io ci metto i renziani,0
560.jpg,42,2019-08-12,1,Salvini,quando chiedi i pieni poteri ma l'unico che ti viene concesso è quello del cristallo di luna,1
561.jpg,695,2019-08-14,0,0,io t'avevo chiamato pe sape come eri messo paa colazione de feragosto,1
562.jpg,34,2019-08-20,0,Conte,"""non abbiamo bisogno di persone e uomini con pieni poteri, ma che abbiano cultura istituzionale e senso di responsabilità"" giuseppe conte",0
563.jpg,12,2019-08-29,0,0,"comunque, se volete, vengo io a governare in italia... a me qui è lungo il fatto!",1
564.jpg,385,2018-08-26,1,0,comunisti,1
565.jpg,2,2019-08-28,0,0,tutto bene tg1 diretta,0
566.jpg,334,2019-08-20,1,0,che estate fantastica!,1
567.jpg,124,2019-08-27,0,Conte,onestà! bella ciao!,0
568.jpg,308,2017-10-31,1,D'Alema,stranger things 2,1
569.jpg,2,2019-08-25,0,0,cosa ti fa pensare che ci estingueremo? il tempo che dedicate allo scioglimento delle camere piuttosto che a quello dei ghiacciai.,0
570.jpg,22,2019-08-21,0,draghi,3 parole 18 lettere dille e sarò tua mario draghi premier,1
571.jpg,116,2019-08-30,0,0,"i giorni di conte per matteo salvini, pd e m5s erano già d'accordo per un ribaltone molto + abbastanza d'accordo poco + per nulla d'accordo 28,7% 71,3% fonte: sondaggio quorum youtrend per sky tg24",0
572.jpg,510,2019-08-30,0,0,"marco furfaro @marcofurfaro una fatica assurda, lavoriamo giorno e notte per provare a costruire un programma serio e di svolta. poi, le giravolte incomprensibili. siamo gente che ha a cuore l'italia... ma gli ultimatum di di maio e le sue ambizioni personali sono insopportabili. #governocontebis 16:26 30/08/19 twitter web app",0
573.jpg,26830,2019-08-28,1,Salvini,"""mi ero scordato che lavorasse qui"" poliziotto spara a salvini mentre cerca di entrare al viminale",1
574.jpg,9,2019-09-10,0,"Di Maio, Salvini, Conte",a mangiare sa simbua frita a villanovaforru ci vieni lo stesso?,1
575.jpg,34,2019-08-26,0,Salvini,san lazzaro allora ti vuoi alzare,0
576.jpg,698,2019-08-28,1,Zingaretti,dopo attente ed accurate verifiche la direzione nazionale del pd ha deliberato che di maio può partecipare all'azione di governo ... come vice-spalatore di cacca di animali circensi,1
577.jpg,216,2019-08-21,0,Salvini,"amore mio, da dove vengo io un bacio ed un addio sono la stessa cosa",1
578.jpg,132,2017-06-20,0,0,for really big mistakes. sinistra cazzate libertà,1
579.jpg,52,2019-11-15,0,0,liberateci stocazzo,1
580.jpg,563,2019-08-08,0,0,"quel momento in cui senti ""si sta per dimettere conte"" e anziché #crisidigoverno dai per scontato che sia #crisiinter.",0
581.jpg,46,2019-08-13,0,0,fa talmente caldo che se so' sciole pure le camere!,0
582.jpg,9,2019-08-28,1,0,@crisidigoverno camera dei deputati,1
