1178.jpg,107,2019-08-19,0,"Di Maio, Boschi",o famo strano?,1
1179.jpg,132,2019-08-20,1,Mattarella,"quando hai rinunciato alle ferie perché giuseppe, matteo e luigi dovevano salire al colle ma non vedi arrivare nessuno @carpenoctem_pnd a disgraziati fiji de na mign*tta, andò ca**o state?",1
1180.jpg,9,2019-08-20,0,0,0,0
1181.jpg,2,2019-08-17,0,0,"(mic l'ape) rassegna stramba politica. secondo gli analisti, ad oggi, il settore destro offre il destro al settore sinistro per fare cose sinistre; in mezzo, pezzi dei due opposti settori",0
1182.jpg,19,2019-08-16,0,"Renzi, Di Maio, Salvini, Berlusconi",commedia all'italiana,0
1183.jpg,14,2019-08-31,0,"Mattarella, Conte","""che fai stavolta, te fermi 'n po' de più!?"" ""e che te devo di'... co i regazzini appresso è sempre 'n casino!""",1
1184.jpg,91,2019-10-30,1,Salvini,dra-culo,1
1185.jpg,40,2019-08-13,0,Renzi,infami grillini!!! offro loro l'occasione di far saltare il pd...e mi lasciano in mutande.,0
1186.jpg,0,2019-08-19,0,0,arrivano i nuovi barbari purchè non usino le nostre toilette,0
1187.jpg,443,2019-07-12,0,Salvini,quando fai il presepe e sbagli la misura dell'asino,1
1188.jpg,8,2019-08-20,0,"Conte, Salvini",all the crisis like the isis can't be easy,1
1189.jpg,649,2019-08-27,0,0,"consultazioni, domani sarà il turno della ndrangheta",1
1190.jpg,33,2019-09-01,1,Salvini,una mattina... mi son svegliato viminale ciao fidanzata ciao papeete ciao ciao ciao,1
1191.jpg,25,2019-08-20,0,"Conte, Di Maio, Salvini","+: cosa diresti a salvini? -: ""c cantass pur a conzuncell"" 'ce ricess: 'chella granda fessa sguarrat 'è mammt""",1
1192.jpg,3,2019-08-23,0,0,"di maio avvia le interlocuzioni, ma poi gli si spegne l'auto al bivio fra lega e pd.",1
1193.jpg,108,2019-05-14,1,0,pompierino... pompierino... lo vuoi lo striscione?? salvini merda,1
1194.jpg,678,2019-08-08,0,0,"salvini ai suoi: ""la maggioranza non c'è più, le vacanze non siano una scusa."" e convoca tutti domani al papeete beach, per un'apericrisi. #salvini #dimaio #crisidigoverno #crisi #ultimora #8agosto #propagandalive #inondala7",0
1195.jpg,21,2019-08-14,0,Di Maio,"non mi sono mai piaciute quelle persone che fanno gli amici di tutti. per me l'amicizia è una cosa seria, è un valore fondamentale nella vita. i veri amici sono sempre leali. d'ora in poi chiamiamoci con nome e cognome.",0
1196.jpg,8,2019-08-27,1,0,repubblica dei cachi,1
1197.jpg,338,2019-09-03,0,0,fabrizio delprete si allungano i tempi per il calcolo delle votazioni. di maio sta cambiando manualmente i no in sì. #piattaformarousseau,0
1198.jpg,316,2019-09-03,0,"Mattarella,","ma te pare normale che devo aspettà l'esito della piattaforma rousseau? so ragazzi particolari, c'hanno 'n sacco de grillo pe' la testa!",1
1199.jpg,10948,2019-08-28,1,"Mattarella, Casalino, Bonafede, Di Maio, Conte, Zingaretti, Renzi","il signore dei ministri. un mattarello per domarli, un mattarello per trovarli, un mattarello per ghermirli e nel buio incatenarli, nella terra del colle, dove l'ombra cupa scende",1
1200.jpg,106,2019-08-12,1,"Di Maio, Conte, Salvini",di maio e conte furiosi con me perché volevano governare 5 anni con provvedimenti inutili. io che ho il 40% ma devo governare con meno parlamentari di forza italia e meno della metà del 5s,1
1201.jpg,5,2019-08-20,0,0,"ma solo io sono rimasto scandalizzato dal fatto che salvini abbia tradotto ""omnia vincit amor"" con ""l'amore vince sempre""??? e ha pure fatto il liceo classico!!!",0
1202.jpg,8,2019-09-01,0,0,#letterman83 siamo nella merda fino a qua,0
1203.jpg,133,2019-08-09,0,0,avrò un governo tutto mio salvini con la meloni e squillo di lusso (berlusconi),1
1204.jpg,71,2019-08-22,0,Conte,salsiccia o hamburger? sto in crisi,1
1205.jpg,4,2019-08-20,1,"Salvini, Conte, Di Maio",ce n'è per tutti,1
1206.jpg,2,2019-09-01,0,0,"la tua scelta di fiducia sisa gli snack di mais 200g (al kg €4,95) €0,99 promozione valida dal 1 al 30 settembre 2019",0
1207.jpg,73,2019-08-20,1,Renzi,il vero tonto all'olio di oliva,1
1208.jpg,1104,2019-08-14,0,0,giuseppe civati laicamente. diffidate sempre di chi esibisce simboli religiosi in politica. sempre. soprattutto se li brandisce. soprattutto se li mortifica.,0
1209.jpg,41,2019-08-20,0,0,abraham b. yehoshua un divorzio tardivo,0
1210.jpg,166,2019-08-20,0,"Conte, Salvini","salvini, sei vomitevole",1
1211.jpg,8,2019-08-10,0,Salvini,"pieni poteri? ma chi cazzo sei? non ti allargare belina mia beata vergine maria dolce e immacolata, perché mi tratti così male?",1
1212.jpg,19,2019-08-21,0,Conte,"ma angela, non ti preoccupare sono molto determinato la7.it esclusivo: conte e merkel a davos - tutta la conversazione.",0
1213.jpg,13,2020-04-27,0,0,inconsapevoli addormentati. cov-id 19/id 20. tracciare i postivi per il controllo globale? non è salvini,1
1214.jpg,1320,2019-08-20,0,"Conte, Salvini","""sta mano po esse fero o po esse piuma...""",1
1215.jpg,17,2019-08-28,1,Conte,io tifo conte,1
1216.jpg,551,2019-08-21,0,"Conte, Salvini",settembre 2018 #decretosalvini sicurezza e immigrazione noi questo non ce lo scordiamo,0
1217.jpg,399,2019-08-22,0,0,"fab mattarella dopo gli incontri di oggi, domani avrà un'altra importantissima seduta. dallo psicologo #consultazioni #ultimora #maratonamenta #mattarella #crisidigoverno #propagandalive",0
1218.jpg,13,2019-09-03,0,Salvini,"matteo salvini ma che bello il ""clima"" del governo a guida pd: sbarcati gli immigrati della nave dei centri sociali per ""emergenza sanitaria""... ma pensano che gli italiani siano scemi??? fai girare! #salvinistudia",0
1219.jpg,14,2019-08-30,0,Salvini,"no poltrone e rimpasti, no governi tecnici! la parola torna agli italiani!",0
1220.jpg,31,2019-08-10,1,"Salvini, Di Maio",se restituirebbe i 49 milioni,1
1221.jpg,17,2019-08-28,1,0,detroit beco mentana,1
1222.jpg,8,2019-08-26,0,"Conte, Di Maio, Zingaretti",seguimi su: fabrizio gareggia - sindaco di cannara,0
1223.jpg,22,2019-08-30,0,0,mi vogliono come presidente del consiglio? del resto come li do io i consigli... votantonia sindaco de roma,0
1224.jpg,18,2019-08-11,0,0,"la bizona ""c'è 4-5-1 o 4-4-2, o invece uso una cosa diversa: il 5-5-5""",0
1225.jpg,51,2019-08-22,0,Zingaretti,che bello!!!! si discute ancora...,1
1226.jpg,27,2019-08-29,0,0,è andato via salvini?,1
1227.jpg,17,2019-08-16,0,0,fratelli d’italia preparatevi per la prossima stagione perché sarà la nostra giorgia meloni,0
1228.jpg,44,2019-08-26,0,"Di Maio, Salvini",comunque sentimose... anche pe fasse na partita alla magic escape,1
1229.jpg,90,2019-08-14,0,0,"di maio: ""per colpa di salvini salteranno reddito di cittadinanza e quota 100"". minchia, sta già iniziando a incolpare gli alleati precedenti.",0
1230.jpg,97,2018-07-14,1,Salvini,non autorizzo nessuno a scendere. basta con le cazzate,1
1231.jpg,11,2019-08-21,0,"Salvini, Conte",ce manca solo che me dai der fijo de 'na mignotta... mo' ci arivo: sta a pagina 4,1
1232.jpg,64,2019-08-28,0,Taverna,"questi del pd sono mafiosi, schifosi. siete delle merde. dovete morire. prima insulti al pd? quello è il passato. oggi è diverso. paola taverna",0
1233.jpg,22,2019-09-10,1,Salvini,tra qualche anno… ridiamo per non piangere chi fece cadere il primo governo conte nell'agosto 2019? a massimo d'alema b una buccia di banana c il gabibbo d matteo salvini,1
1234.jpg,690,2019-08-20,0,0,la lega ha ritirato la mozione di sfiducia,0
1235.jpg,46,2019-09-10,1,"Salvini, Meloni",dirty dancing hit maniac,1
1236.jpg,6,2019-08-08,0,0,"alessandro amico 17 minuti il primo ministro conte nella conferenza stampa appena terminata, ha annunciato che l'esperienza di governo termina per volontà di salvini, che ha interrotto bruscamente la legislatura. ""dovrà spiegare agli elettori la motivazione di questa decisione, prendendosi le responsabilità e le conseguenza che verranno"" chiederà un colloquio ai presidenti di camera e senato per parlamentarizzare la crisi. la crisi è ufficializzata! parole molto dure quelle del primo ministro che ha attaccato pesantemente salvini, giustamente, togliendosi più di un sassolino dalla scarpa e con tono iracondo.",0
1237.jpg,289,2019-08-24,0,Di Maio,e allora il pepeete?,1
1238.jpg,40,2019-09-06,0,0,di maio col pd,0
1239.jpg,280,2019-08-22,0,"Salvini, Renzi",re-animator,0
1240.jpg,12131,2019-08-26,1,Conte,conte 2.0,0
1241.jpg,27,2019-08-27,0,0,ma sta destra che dice: è un governo non votato dal popolo. perché 5s e lega lo era? #crisidigoverno,0
1242.jpg,1906,2019-08-21,0,"Conte, Salvini","quando ti interroghi su chi abbia fatto affogare tutti i tuoi pacchetti. udp, io",1
1243.jpg,122,2019-08-23,0,"Di Maio, Zingaretti",zingaretti apre al m5s,0
1244.jpg,8,2019-08-20,0,0,dimmi con chi vai... e non so più chi sei,0
1245.jpg,492,2019-08-25,0,0,"laura boldrini @lauraboldrini 2g zingaretti fa bene a porre chiare condizioni governo con #m5s nasce in netta discontinuità coi danni provocati da salvini & co. mettendo al centro i temi del lavoro, dell'ambiente e dei diritti. altrimenti andiamo al voto, senza paura di sfidare la peggiore destra di sempre 761 665 5173 le frasi di osho @lefrasidiosho 1h cor 2% c'è poco da avé paura. sfonnateli!",0
1246.jpg,74,2019-08-13,0,Meloni,elezioni subito firma anche tu! no a governi contro la volontà popolare fratelli d’italia,0
1247.jpg,12,2019-08-18,0,0,"satira cruda salvini a di maio: ""il mio telefono è sempre acceso"". ed io pago! (cit. a. de curtis) dottkang",0
1248.jpg,73,2019-08-13,0,0,decreto sicurezza reddito di cittadinanza propaganda becera andare al papeete politiche utili per il paese,1
1249.jpg,25,2019-08-27,0,0,"aheee, dicite a de laurentis che salvini è svincolato",0
1250.jpg,11,2019-08-28,0,Salvini,anime opening,1
1251.jpg,17,2019-08-22,1,Mattarella,"maledettiiiiii! old man shout ""maledetti"" to the italian parties",1
1252.jpg,43,2019-08-09,0,Di Maio,"faceva le fusa, eh? aveva un volto umano, vero? kutoshi kimino 2019",0
1253.jpg,66,2018-02-09,1,Salvini,molti nemici molto stronzo,1
1254.jpg,19,2019-08-22,1,Salvini,potere dell'immacolato cuore di maria vieni a me!,1
1255.jpg,153,2019-08-27,0,"Salvini, Conte",il rappresentante che me le ha mandate assicurandomi che fossero buonissime io che leggo le dispense che mi hanno mandato accorgendomi che sono almeno di 6 anni fa,1
1256.jpg,19,2019-08-08,0,0,"miciomocio a superquark lotta per la sopravvivenza, predatori e prede, guardati bene le spalle... sembra palazzo chigi!",1
1257.jpg,51,2019-09-25,1,"Conte, Di Maio",ho imparato il tuo nome in inglese with you,1
1258.jpg,97,2019-08-16,0,Salvini,lo sai perché salvini ha tutti contro? perché ha negato il massacro di srebenica,1
1259.jpg,9,2019-08-12,0,Di Maio,"toglietemi tutto, ma non la mia poltrona. poltronachigi se la provi, t'innamori",1
1260.jpg,697,2019-05-21,0,Meloni,no agli sbarchi di teste di cazzo!,1
1261.jpg,132,2019-08-10,1,"Salvini, Di Maio",lovely i wish i was the actual prime minister of italy is is done. poof nothing's changed. correct.,1
1262.jpg,7443,2019-02-18,0,M5S,"aspettate, sta per dire qualcosa di stupido",1
1263.jpg,95,2019-08-16,1,Salvini,siete su scherzi a parte wawe,1
1264.jpg,97,2019-08-19,0,0,"per come si stanno mettendo le cose, avrei una proposta di modifica dell'art. 1 della costituzione: ""l'italia è una repubblica fondata sul 'dove cazzo lo trovo un altro posto a 15 mille euro al mese'?""",0
1265.jpg,24,2019-09-27,0,Salvini,salvini mentre controlla di avere ancora tutti i suoi elettori,1
1266.jpg,856,2019-08-10,1,"Di Maio, Salvini",knockout,1
1267.jpg,6,2019-08-26,0,Mattarella,aspettando martedì... predisponete gli ombrelli e dite agli italiani di usare la vasellina!,0
1268.jpg,41,2019-08-30,0,"Salvini, Lega",taglio parlamentari e poi #votosubito la parola agli italiani! matteo salvini,0
1269.jpg,14,2019-08-09,0,Salvini,"""senti, come eravamo rimasti d'accordo?"" ""tranquillo, ora te lo faccio firmare io il contratto di governo"".",1
1270.jpg,15,2019-08-28,0,Meloni,"giorgia meloni visto che il m5s ha annunciato la votazione su rousseau per decidere sul governo, faccio un sondaggio anche io. secondo voi questo nuovo governo nascerebbe unicamente per evitare che in molti perdano la poltrona e per impedire agli italiani di votare? sì sì",0
1271.jpg,286,2019-08-28,0,0,ultim'ora zingaretti: non è staffetta ma 19:27 ultim'ora brexit 500mila firme contro chiusura parlame,0
1272.jpg,15,2019-07-13,1,"Salvini, Di Maio","continuavano a chiamarlo… ""governo delle nullità""",1
1273.jpg,8,2019-08-29,1,Salvini,maalox,1
1274.jpg,3301,2019-08-22,0,"Salvini, Conte",se ora ti dicessi che la repubblica è sotto il dominio del signore oscuro dei sith?,1
1275.jpg,26,2019-08-10,0,0,elezioni senza se e senza ma. il segretario zingaretti l'ha espresso chiaramente e noi seguiremo la sua linea. è tempo di combattere. #crisidigoverno,0
1276.jpg,75,2019-08-21,0,"Salvini, Conte",quando ai colloqui il prof che ti portava sulle palle iniziava a sputtanarti davanti a tuo padre,1
1277.jpg,46,2019-08-26,1,Mattarella,mattarella opta per il conte bis.,1
1278.jpg,235,2019-11-16,0,0,quando sento dire che salvini vorrebbe abolire sia la scuola media che le vacanze estive: a te che non ti fai mai i cazzi tuoi. io ti odio!!!!!!!!,1
1279.jpg,16,2019-08-29,0,0,"federica.zanco @telenext ma vaselina si scrive con due elle? telenext @federica.zanco si può scrivere sia con una che con due ma giustamente come puoi saperlo visto chi voti…io ne ho messe due xché questa è più forte ma non tanto da pararti x bene contro i tuoi amici.... capitone come il loro non esiste toniodg13 @telenext mi sa che la vaselina servirà a te, sei un po' troppo agitato per la sconfitta di salvy...sconfitta autoinflitta, ovviamente",0
1280.jpg,200,2019-09-03,0,0,#sì al nuovo governo conte movimento,0
1281.jpg,42,2019-08-28,0,0,"""sta per nascere un governo lontano dal paese reale"" ha dichiarato salvini. dalla padania. (badu) kotiomkin",0
1282.jpg,18,2019-08-21,0,"Mattarella, Salvini","open arms, usa gli scatoloni",0
1283.jpg,42,2019-08-20,0,0,un completo armani parla con renzi dentro,0
1284.jpg,19,2019-08-14,0,"Berlusconi, Salvini","quando fa caldo, c'è afa, fail il wod e stai per morire... ma puoi sempre contare sul tuo amico al box",1
1285.jpg,74,2019-08-14,1,"Salvini, Di Maio",ferragosto tranquilli crisi di governo,1
1286.jpg,140,2019-08-21,0,0,prof. avv. giuseppe conte salvoini nicola zingaretti,1
1287.jpg,65,2019-08-31,0,0,"i giorni di conte l'immigrazione ha avuto un impatto positivo sull'economia italiana. è d'accordo con questa affermazione? molto + abbastanza d'accordo 30,9% né d'accordo + né in disaccordo 26,0% molto + abbastanza in disaccordo 43,1% fonte: sondaggio quorum youtrend per sky tg24",0
1288.jpg,460,2019-08-31,0,Salvini,"@capitan.salvino ora che mi avete aperto i porti, vado a chiudere i laghi, i fiumi e pure le pozzanghere!!",1
1289.jpg,12,2019-08-28,0,"Mattarella, Salvini",c'ho un amico che lavora al papeete ha detto che qualcosa mi trova...,1
1290.jpg,28,2019-08-12,0,0,a casa loro!,0
1291.jpg,6,2019-08-22,0,Salvini,si addormenta al papeete e si sveglia fuori dal governo,1
1292.jpg,4,2019-08-21,0,0,rassegna stramba formazione del governo. fratture dopo la crisi; situazione ancora ingessata. mattarella sta pensando di sentire anche un ortopedico nel giro di consultazioni.,0
1293.jpg,3,2019-08-22,0,Salvini,ore 16: rifarei tutto ore 20: ritiro la sfiducia,1
1294.jpg,35,2019-06-10,1,Renzi,una cazzata al giorno leva il movimento 5 stelle di torno,1
1295.jpg,20,2019-08-20,0,"Salvini, Conte",fatality,0
1296.jpg,65,2019-08-27,1,Mattarella,"quando sei mattarella e ti dicono se vuioi tornare al voto. akuna matatta ragazzi e bentornati dal vostro cicciogaymer89, siamo tornati su un nuovo meme che vi andrò a spiegare. quindi cappio al collo e lezzego! ma prima di tutto: come fossero i calciatori senza den- no sto scherzando quello lo dice mio fratello! allora riprendendo questo meme in mano e parliamone. praticamente cuesto meme parla di attarela che sta per sciegliere tra dare il voto ai italiani o lasciare il governo in mano ai comunisti. tanto lo sappiamo che sceglie i comunisti ed è per questo che gli farridere al presidente. ci vediamo in un prossimo video di fortnite e comprate la mia guida di fortnite che diventate forti come ningia.",1
1297.jpg,31,2019-08-16,0,"Di Maio, Salvini","""senti lui', sto nella merda... ti va bene se fai tu il premier e ti offro un aperitivo al papeete?""",1
1298.jpg,25,2019-08-21,0,0,io con la crisi di governo io senza la crisi di governo io con governo tecnico 5stellelegapdcraxi io con nuove elezioni,1
1299.jpg,618,2019-08-10,0,"Salvini, M5S","luciz azzolina portavoce alla camera dei deputati ignora anche la costituzione #matteosalvini ""voglio pieni poteri""",0
1300.jpg,143,2019-09-01,0,0,quando il movimento 5 stelle anche se non ha uno straccio di consensi crea un governo alleandosi con i suoi peggior nemici that's how mafia works,1
1301.jpg,821,2019-09-01,1,Salvini,se credi in lui scrivi amen nei commenti e condividi,1
1302.jpg,10,2019-08-22,0,0,"satira cruda zingaretti - casaleggio: ""bandiera rousseau trionferà!"" dottkang",0
1303.jpg,46,2019-08-09,0,"Salvini, Di Maio",agosto governo mio non ti conosco! aspietta penza a' creatura,0
1304.jpg,20,2019-08-29,0,0,"l’italia è una repubblica democratica, fondata sul lavoro. la sovranità appartiene al popolo, che la esercita nelle forme e nei limiti della costituzione. art. 1 - costituzione della repubblica italiana",0
1305.jpg,1934,2019-08-20,0,"Salvini, Conte","io durante l'esame di progettazione mentre spiego il progetto al prof. il mio compagno sfaticato che, non ricordandosi nulla del progetto, spera che il prof non gli faccia domande",1
1306.jpg,11,2019-09-09,0,0,ma se batman va a puttane mountain lion scopa le bat-tone?,1
1307.jpg,47,2019-08-14,0,0,"""me vado 'n attimo a cambià che sotto c'ho er costume fracico""",0
1308.jpg,14,2019-08-21,0,0,linear economy recycling economy circular economy take take take make make make use recycle use recycle return use use waste repair reuse,0
1309.jpg,17,2017-03-05,1,Renzi,pio perculo,1
1310.jpg,3,2019-08-09,0,0,salvini 5 stelle pd,1
1311.jpg,253,2019-08-10,1,Salvini,"mentre salvini era in spiaggia il parlamento ha approvato: dl cultura, legge sport, sicurezza bis porti rispetto per chi lavora",0
1312.jpg,5,2019-08-21,0,0,ho la nausea: o sono incinta o sono italiana.,0
1313.jpg,8,2019-08-30,1,"Zingaretti, Di Maio, Mattarella",nun me fate incazzà! ridete che ce guardano!!,1
1314.jpg,29,2019-08-10,0,0,ma l'originalità di far cadere i 5 stelle la notte di san lorenzo? salvini è un romanticone. antonella carulli,0
1315.jpg,89,2019-08-10,0,0,"rainews24 speciale studio24 al telefono alessandro cattaneo forza italia ultim'ora de micheli (pd) a studio24: con apertura crisi spero attenzione per proposte pd cina, morti, dispersi e un milione di sfollati per ciclone lekime",0
1316.jpg,50,2019-08-11,0,"Renzi, Di Maio, PD, M5S",io dico no!!! governo di disperazione nazionale,1
1317.jpg,37,2019-08-21,0,"Salvini, Conte",mica t'avevo riconosciuto vestito,1
1318.jpg,104,2019-08-29,1,"Conte, Zingaretti",conte bis lo schiaffo alla democrazia,0
1319.jpg,5,2019-08-10,0,Di Maio,"""panini acqua minerale cocaaa""",1
1320.jpg,38,2019-08-26,0,"Renzi, Letta","enrico, stai sereno!",1
1321.jpg,25,2019-09-05,1,Di Maio,tranquillo giggino andrà tutto bene,1
1322.jpg,39,2019-08-08,0,Di Maio,beni rifugio,0
1323.jpg,1,2019-08-25,0,0,il vero crollo è stato quando ho scoperto che bersani mi chiamava mucca nel corridoio... nemmeno toro!!!,0
1324.jpg,1297,2020-02-24,0,0,che bel pappagallo. che bel pappagallo. sei un coglione. sei un coglione. salvini è il mio capitano. sei un coglione,1
1325.jpg,15,2019-08-23,0,0,il 26 settembre fuori il nuovo singolo on youtube #isoladiplastica hai mai pensato...?!,0
1326.jpg,370,2019-08-27,0,0,"come mossa diversiva mi infiltrerò nelle trattative per il nuovo governo italiano, tanto questi non capiscono un ca**zzo",1
1327.jpg,89,2019-09-01,0,0,"maestra, have fun aaa cercasi politico che non abbia mai promesso un aumento dello stipendio degli insegnanti.",0
1328.jpg,2,2019-08-08,0,0,"insegnamenti del filosofo sarai davvero saggio se, prima di morire, riuscirai a capire quale sia stata la minchiata più grossa detta quest'anno: ""il governo resterà in carica 5 anni"" oppure ""sarà un anno bellissimo!""? @ppacioni_ago19",0
1329.jpg,26,2019-08-27,0,Conte,il contratto di governo mantenere in corso 15 10 35 promesse 1 9 non mantenute in attesa,0
1330.jpg,112,2019-08-22,0,0,posso tornare a stendere le lenzuola sul balcone? guido baraldi,0
1331.jpg,36,2019-08-23,1,0,live breaking news sarà governo poetico 11:39 mattarella scioglie gli indugi e dà l'incarico al gruppo misto militante,1
1332.jpg,165,2019-08-16,0,0,svelato l'arcano: l'hanno chiamato governo del cambiamento perché salvini cambia idea ogni quarto d'ora,0
1333.jpg,203,2019-08-22,1,M5S,movimento ilblogdellepoltrone.it,1
1334.jpg,23,2019-08-26,1,Salvini,"*far cadere il governo, abbassare i sondaggi della lega, rovinare l'alleanza con il m5s, ma hai 1.7 milioni di follower su instagram i'm gonna do what's called a pro-gamer move.",1
1335.jpg,34,2019-08-22,0,Di Maio,"il coraggio non è di chi scappa ma di chi resta e tenta di cambiare le cose. al movimento questo coraggio non è mancato, anche a rischio di perdere consenso!",0
1336.jpg,23,2019-08-23,0,"Berlusconi,","silvio berlusconi cari italiani, in questo momento difficile per il paese volevo solo ricordarvi che a me piace un sacco la figa.",1
1337.jpg,1,2019-08-23,0,0,per un governo della sostenibilità - appello alle forze politiche,0
1338.jpg,20,2019-08-23,0,0,"forse sarebbe il caso di leggere studiare e ripassare la bossi-fini, le norme sull'immigrazione e le norme pensionistiche vigenti in italia. poi sarebbe il caso di andare a controllare i fondi di cui dispone l'italia (entrate e uscite). poi sarebbe il caso di trovare casi in cui le ong vengono pagate dagli scafisti (nessuno). prima di parlare sarebbe il caso di informarsi. giorgia meloni tutta la vita!!!!!!!!!!! forza inter!!!!!!!!! nemmeno su questo andiamo d'accordo forza juventus",0
1339.jpg,18,2019-09-06,0,0,la terra di sicilia è la più ricca del mondo abbiamo zolfo petrolio sale gas e prodotti agricoli di eccellenza ....e nonostante tutto siamo poveri ...forse siamo un popolo di coglioni,0
1340.jpg,247,2019-08-27,0,Zingaretti,che màl e càp,1
1341.jpg,3,2019-08-20,0,0,"de falco: e concludo, andate a casa! #personaggetto #crisidigoverno",0
1342.jpg,156,2019-08-22,0,0,destinare i fondi di quota 100 e reddito di cittadinanza per gli sgravi sul lavoro: + lavoro - sussidi,0
1343.jpg,968,2019-08-13,0,0,m5s apriremo il parlamento come una scatoletta di tonno. la scatoletta di tonno,1
1344.jpg,3492,2018-06-12,1,Conte,vertice ue. conte sostituito da una sagoma di cartone ma nessuno se ne accorge,1
1345.jpg,54,2019-08-21,0,0,crisi di governo cosa succede ora?,0
1346.jpg,806,2019-08-12,0,"Berlusconi, Salvini",guarda co di maio ce so annato solo per capi quanto ce tenevi a me,1
1347.jpg,5,2019-08-11,1,Meloni,ambrogio la mia non è proprio fame... è più voglia di riproporre un passato glorioso mai esistito buttandomi in politica interpretando il ruolo eteronormativo e maschilista della donna sovranista inconsapevole del fatto che le mie ambizioni non saranno soddisfatte e finire a fare la paraspifferi sovranista del futuro governo salvini.,1
1348.jpg,10,2020-04-25,0,Salvini,"quando sei in calo nei sondaggi e decidi di tagliarti la barba e fai capire a tutti che l'espressione faccia da culo non è solo in senso figurato, ma anche in senso letterale",1
1349.jpg,35,2019-08-15,0,0,i cuochini non hanno il citofono,0
1350.jpg,2041,2018-03-10,0,Conte,"dopo la mano della regina elisabetta, anche l'italia ha deciso di dotarsi di un premier finto solo per salutare la gente",1
1351.jpg,31,2015-08-23,1,Salvini,sempre presente in televisione sempre assente al parlamento europeo 18 mile euro di stipendio al mese corruzione e mazzette su appalti e grandi opere parassita ... e vieni a farti le vacanze a scrocco in sicilia per parlare di immigrazione,1
1352.jpg,8,2019-08-28,0,0,"che poi pensavo... dicono di salvini che vuole riportare il fascismo... ed infatti ""se"" mattarella accetterà questo schifo il fascismo chi lo porterà? signori miei viviamo in dittatura.. inutile dire!! gli altri decidono per noi!!!! in un paese dove il popolo non conta nulla ""non è un paese libero!""",0
1353.jpg,9,2019-08-21,0,"Salvini, Conte",manifesto la pacchia è finita,0
1354.jpg,3,2019-08-28,0,Mattarella,"messaggi di solidarietà a mattarella, anche dall'amazzonia",0
1355.jpg,18,2019-08-12,0,"Di Maio, Renzi, M5S, PD","con la scusa del taglio dei parlamentari che bloccherebbe il parlamento per un anno questi due difendono solo la poltrona! gratta il grillino trovi il piddino! no inciuci, voto subito!",0
1356.jpg,20,2019-08-21,0,0,complici di un piano,0
1357.jpg,186,2019-08-27,0,Salvini,"""onore e libertà valgono più di 1.000 ministeri. non si molla, mai!"" matteo salvini ma soprattutto: non si molla, mai, la poltrona!",1
1358.jpg,44,2019-08-22,0,"Salvini, Conte","@boardgamememeitalia oh, comunque la campagna di gloomhaven la portiamo avanti lo stesso",1
1359.jpg,112,2019-08-21,0,"Salvini, Conte","potere del santissimo rosario, vieni a me! santino di padre pio, proteggimi!",0
1360.jpg,79,2019-09-02,0,Di Maio,... c così gli ho detto: o accettate questi 20 punti o tornate a casa!,0
1361.jpg,5,2019-08-29,0,0,cambia gestione,0
1362.jpg,18,2019-08-28,0,"Meloni, Salvini",influencer,0
1363.jpg,119,2019-09-03,0,Mattarella,"chi, minchia, ha cambiato la password alla wi-fi? provi con ""mojito2019"", presidente!",0
1364.jpg,33,2019-08-25,1,"Salvini, Conte, Mattarella, Di Maio",nulla è ancora deciso perché manca il mio voto che può confermare o ribaltare il risultato,1
1365.jpg,54,2019-08-23,0,0,"7,4mila dall'aula al senato il dibattito sulle comunicazioni",0
1366.jpg,37,2019-09-02,0,0,giurie popolari piattaforma russò... ...alle porte del buiooo!,0
