File, Engagement, Dates, Manipulation, Visual, Text, Meme
0.jpg, 11,2019-08-12,1, Salvini, raw satire vote us .. we will speak the party of tight bandages our motto: salvini league it takes restrictions and we will adopt it, 1
1.jpg, 2261,2019-08-21,0,0, "sin for excise, come on. We were almost there.", 0
2.jpg, 1327,2019-08-23,0, "Salvini, Di Maio", "" "what's still there?" "" "I'm expecting a child" "", 1
3.jpg, 18,2019-08-27,0,0, now in special air gr1 listen to the live follow rai radio 1 special gr 1,0
4.jpg, 617,2019-08-25,0, "Salvini, Di Maio", it's nonsense that I'm doing and it's only your fault, 1
5.jpg, 21,2019-08-20,0, Salvini, when mom scolds you and you know she is right, 1
6.jpg, 52,2019-08-30,1, Salvini, cursed renzi, 1
7.jpg, 13314,2020-04-04,0, Salvini, "Matteo Salvini: science alone is not enough, we reopen the churches. Italian media: attention, he is about to say something stupid", 1
8.jpg, 1201,2018-06-19,1, "Di Maio, Salvini", "rom wil tear us apart, again", 1
9.jpg, 287,2019-08-09,0, Di Maio, "the electoral window matteo !!! if you drop the government i'm going downstairs! Look what i do, huh !! i did it .... ..matteo ??? teo? ... teuccio? ", 0
10.jpg, 14,2019-08-14,0,0, antoniocolucciufficiale, 0
11.jpg, 28,2019-08-12,0,0, where is it now ?, 0
12.jpg, 32,2019-08-28,0,0, "studio and marathon director, my director @maratonetidimentana maratonamentana", 0
13.jpg, 7,2019-08-31,0, Salvini, "" "there is something in common between human warmth and that of coffee ... bitterness, without a doubt" ". Laurent houndegla", 0
14.jpg, 147,2019-02-22,0, Salvini, on rai2 we have come to the cult of asshole, 1
15.jpg, 4,2019-08-08,1, Grillo, I'll give you the tav beppe grillo, 1
16.jpg, 47,2019-08-26,1, Di Maio, conversing with gypsies for an m5s-pd alliance conversing with gypsies for an m5s-pd alliance exchanging messages with salvini to keep open a second front m5s-league 1
17.jpg, 50,2019-08-22,0, Mattarella, with deep regret I have to inform you that for an unpredictable mistake the copy of the announced Czechoslovak film did not arrive in time and therefore the screening cannot take place, 1
18.jpg, 129,2019-07-27,1, Salvini, italy corruption precariousness fixed public debt schools without funds large useless works european union, 1
19.jpg, 383,2019-08-20,0, Salvini, "I have a 20 cm NGO that would like to enter your port", 1
20.jpg, 10,2019-08-20,0, Salvini, M5S-pd, 0
21.jpg, 111,2019-09-01,0, "Salvini, Conte, Di Maio, Zingaretti", game of armchairs, 0
22.jpg, 2,2019-08-08,1,0,8 September 2019 great fascist begin the selections of the gf2,1
23.jpg, 81,2019-08-09,1, "Salvini, Meloni", "" "that is, let me understand. Are you telling me that you brought down the government just before the birthday of Count?" "" "But no, but no, I certainly didn't drop it before his birthday, giorgia "" "" hey giuseppe! happy birthday! i just wanted to tell you that ... ahem, but what splendid hair he has! always dressed so well. you are ... a figure, you are! listen though, um ... "" ", 1
24.jpg, 16,2019-08-26,0, casaleggio, sce the rousseau ogno association of the m5s continues # nonmoll, 0
25.jpg, 160,2019-08-29,0,0, but maria hadn't said it would end like this ... free hugs * * as long as you give me an armchair, 0
26.jpg, 290,2019-08-13,0,0, government crisis Tuesday 13 August at 18:00 the senate is called to vote on the scheduling of the political information crisis, 0
27.jpg, 22,2019-08-28,0,0, "politics is the art of mediation. Especially if you face a danger, it becomes an obligation!", 0
28.jpg, 12,2019-08-29,0, Conte, the bis-conte is halved, 1
29.jpg, 7,2019-08-08,0,0, "adnkronos zingaretti a renzi:" "you are a resource, help us win" "", 0
30.jpg, 8,2019-09-03,0,0, according to the latest poll, the league drops and the 5 stars rise. the PD returns to third place. recognized the bronze face, 0
31.jpg, 543,2019-08-20,0, "Salvini, Conte", huh? puppa, 1
32.jpg, 19,2019-08-28,0,0, "Wednesday 28 August, from 7.30 follow me on telelombardia", 0
33.jpg, 3,2019-08-09,0,0, did you like licking hard bread? now you will start doing it again thanks to the great and imminent work of a brand new technical government, 0
34.jpg, 10,2019-08-31,0, Di Maio, is the only thing I have left of him. you won't take it away from me! security decree bis, 0
35.jpg, 4,2019-08-29,0, Conte, "ah shit, here we go again", 1
36.jpg, 457,2019-06-03,0, Salvini, but who the fuck comes first?, 1
37.jpg, 368,2019-08-13,0, Conte, oil gianmauro - m5s senato work will resume on august 20 with communications from the prime minister to the senate hall, 0
38.jpg, 8,2019-10-02,0,0, ... and I conclude with the hashtag # salvinimerda, 1
39.jpg, 5490,2019-08-20,0, "Conte, Salvini", "it's over matteo, I'm higher than you", 1
40.jpg, 15,2016-07-08,0,0, "vladimir, are you interested in the immigrant affair? Listen big ass, you are not talking to that asshole of renzi!", 1
41.jpg, 26,2019-08-20,0,0, conte presents his resignation has been a very bad year., 0
42.jpg, 172,2019-08-09,0,0, "rainews24 ultim'ora salvini opens the crisis: immediately to the vote, count: the parliament will decide 23:59 salvini: majority is gone no more let's go to the vote. no to technical governments. I am running as prime minister ", 0
43.jpg, 19,2019-08-24,1, Salvini, "breaking news salvini calls himself pope 18:15" "from today speakers closed. If bergoglio wants to make the pope apply!" "", 1
44.jpg, 229,2019-08-29,0, Conte, "donald j. Trump starting to look good for the highly respected prime minister of the italian republic, giuseppi conte. Represented italy powerfully at the c.7. Loves his country greatly & works well with the usa. a verytalented man who will hopefully remain prime minister! "" says j'amo sbajato er name ner tweet ... is it up again? "" "" oh well but it's the same "" ", 1
45.jpg, 57,2019-09-03,1, Conte, the lady in rousseau, 1
46.jpg, 442,2019-08-16,1, Salvini, "I bring down the rai government 3 years ago 28,374 views bro it's just a prank | faze rug faze rug 2 years ago 1.9 million views @ capitan.salvino" 1
47.jpg, 1595,2019-08-09,1, "Salvini, Di Maio", temptation island, 1
48.jpg, 2,2019-08-19,0,0, "the gifts of the disabled league, the last gift of the league. The zoccano undersecretary attacks:" "with the advance vote the norm skips for 600 thousand caregivers. At risk also the increase in invalidity pensions "" ", 0
49.jpg, 6,2019-08-29,0,0, "the Italian republic anxious about the response of rousseau." "Va te faire foutre" "", 0
50.jpg, 16,2019-09-03,0,0, so rousseau? yes no 3 they see the number, 0
51.jpg, 25,2019-08-13,0, Salvini, "evening courier updated at 14:55 at 18 the vote in the Senate on the dates of the crisis live. Salvini:" "I'm busy, I won't see Berlusconi" " pd and m5s approach valentina iorio the photo posted by minister salvini on twitter ", 0
52.jpg, 6,2019-08-10,0, Di Maio, "luigi di maio minister of labor, economic development and social policies", 0
53.jpg, 636,2019-08-28,0,0, "in every joking thing there is a small truth: while all the agreements of these hours seem to be falling, you have to go up. And you have to do it together. Only if it becomes a collective mission things can change. #civatisalialle www.ilfirmamento.com ", 0
54.jpg, 13,2019-09-08,0,0, antonio colucci!, 0
55.jpg, 0,2019-09-04,0,0, government from 6+ to 6 and 1/2 ministers pb from 6 =, 0
56.jpg, 3,2019-08-10,0,0, VAT increase 2020 italy close-up, 1
57.jpg, 1,2019-08-27,0,0, great Italian cinema in Venice. small in the rest of the country, 0
58.jpg, 17,2019-08-09,0,0, politics does not violate this place, not only history comes from here, 0
59.jpg, 564,2019-10-10,0, Conte, 4 useless things:, 1
60.jpg, 7,2019-08-19,0,0, politics is making me worm ... call me when you're done! do not disturb, 0
61.jpg, 3,2019-08-09,0,0, "1 unread message today I voted for salvini, but I was disappointed by betraying the 5 stars. I will return to vote 5 stars. Hello", 0
62.jpg, 212,2019-10-27,0,0, "when salvini responds to a criticism saying:" "but then in your opinion all the millions of Italians who vote for me are idiots?" "Me:", 1
63.jpg, 24,2019-08-21,0,0, I with the crisis of government I without crisis of government I with the government ps5stellelegiatogliattimussolini I with new elections, 1
64.jpg, 1,2019-08-19,0, Salvini, jesus just crucified speaks with his apostles ..., 0
65.jpg, 165,2019-08-31,1,0, "mum why are you crying in the bathroom? Answer mum marks montanelli as already read and the future of italy and italians, ruthlessly correct analysis", 1
66.jpg, 49,2019-08-24,0, "Salvini, Di Maio, Mattarella", "did you see? Has the lupara, go ahead you! I'll try to sweeten it ... we are sergy, we brought you the pastarelle that you like them so much ... ", 0
67.jpg, 13,2019-08-28,1, Mattarella, given the latest ... not bad as an idea! breaking news mattarella appoints premier changed constitution overnight - government crisis resolved, 1
68.jpg, 2,2019-09-04,0,0, "sisa Italian supermarkets pasta del capitano toothbrush family strong / medium / soft € 0.50 from 29 August to 11 September 2019", 0
69.jpg, 347,2019-08-23,0, Conte, could you be interested in a position as administrator of a condominium?, 1
70.jpg, 10,2019-08-22,0,0, "government crises actually exist politicians with a very thick brain. It's just that, when they sit down, they are crushed. @Guidorojetti", 0
71.jpg, 28,2019-08-23,0, "Zingaretti, Di Maio", the 5s-pd negotiation promised newlyweds hypothesis of a yellow-red government mattarella: 4 days for the agreement, 0
72.jpg, 3,2019-08-31,0,0, "galbani sisa the italian supermarkets mozzarella vallelata (100g) € 1,99 100% natural from 29 August to 11 September 2019", 0
73.jpg, 358,2016-08-17,1, Salvini, "ew, i stepped in shit.", 1
74.jpg, 3318,2019-08-08,1, "Conte, Di Maio, Salvini, Toninelli, Giorgetti", "the ultimatum of giuseppe conte ugolino:" "program and new ministers or I will devour you all!" "L extreme warning to the two deputy governors: "" out of the gonads the infingards (vo 'included) or how true God I will make the hearty meal of your flesh "" ", 1
75.jpg, 182,2019-09-03,1,0, "rousseau platform question:" "isn't it true that you don't want the 5-star movement to not support the count government together with a party founded on October 14, 2007? or not? "" I agree I do not disagree breaded slices! ", 1
76.jpg, 19,2019-08-08,0, "Di Maio, Salvini, Conte", was a beautiful year!, 1
77.jpg, 10,2019-08-25,0, Mattarella, yellow-green government bis yellow-red government new elections, 0
78.jpg, 260,2019-08-28,0,0, italy the president mattarella has summoned prof. giuseppe conte for 9:30 tomorrow political information, 0
79.jpg, 18,2019-08-27,0, Salvini, binds her to the militants: remove the likes a conte with a whatsapp message, she replies for the harsh words used by the premier against salvini in the senate session on the crisis of government 0
80.jpg, 50,2019-06-15,0, Salvini, we like seagulls from Rome like to rummage 'in the garbage not in the mmerda!, 1
81.jpg, 100,2019-08-29,1, "Di Maio, Zingaretti", poltronesifà, 1
82.jpg, 53,2019-08-24,0, Salvini, salvini criminal, 0
83.jpg, 24,2019-09-03,0,0, antonietta510 that punch put it in the balls dirty communist democratic cracked all gone fargulo jackals traitor of italy mess with eu bastards loan sharks communists shit bomb 1h like it 2 people answer, 0
84.jpg, 2,2019-08-21,0,0, "the sacred immaculate heart of maria in an interview from a seaside resort reveals:" "matteo salvini broke the maroni too. And I remember that I protect everyone, regardless of how many parents one has or does not have; also having a look at my personal history. "" ", 0
85.jpg, 28,2019-08-21,0,0, in the end the virgin mary really protected us. freed us from evil, 0
86.jpg, 578,2019-08-29,0,0, salvini investigated for kidnapping calls to witness the immaculate heart of maria #salviniacasa #salviniscappa # salviniasfaltato, 0
87.jpg, 94,2019-08-30,0, Mattarella, "in short, I'm running the government if it does or not if it does? But what do I know, I did not understand a shit", 0
88.jpg, 13,2019-08-09,0,0, I when they tell me that soon we will have a government salvini / melons, 1
89.jpg, 641,2019-08-18,1, Mattarella, aiu to!, 1
90.jpg, 2,2019-08-30,0,0, because you follow danilotoninelli, 0
91.jpg, 23,2019-08-16,0, Salvini, I would have changed my mind, 0
92.jpg, 31,2019-09-01,0, Grillo, ma bellu segnù de na madonna, 0
93.jpg, 30,2019-08-10,0,0, satirical synapses the Italians gave the country in the hands of the only Milanese who doesn't work and the only Neapolitan who got screwed by a Milanese. anna milani, 0
94.jpg, 11,2019-08-23,0, "Zingaretti, Di Maio", "vigata, 2019. personally, an excited Montalbano commissioner congratulates the agent catarella for his imminent promotion.", 0
95.jpg, 181,2019-09-03,1,0, when you try to vote on rousseau but the site does not load, 1
96.jpg, 33,2019-08-21,0, "Conte, Salvini", "if you had accepted to come here to the Senate to report on the Russian affair, an event that objectively deserves to be clarified also for the reflections on the plan international, you would have avoided your prime minister from appearing in your place, refusing to share the information you have with him. #salvinirispondi ", 0
97.jpg, 7161,2019-08-20,0,0, virgin mary @immigratosmom salvini shit 04:32 pm 20 aug 19 twitter for if, 0
98.jpg, 23,2019-08-25,0,0, diary of the crisis, 0
99.jpg, 4,2019-08-24,1, "Di Maio, Boschi, Cirinnà", luigi di maio never say di maio cirinnà woods, 1
100.jpg, 28,2019-08-11,0, "Salvini, Di Maio", "look me in the eyes, now I am going to tell you that I will not be afraid to be without tel oh jesus ... I don't want to believe it ... "0
101.jpg, 32,2019-08-20,0, Salvini, two-sided strikes again at 4 pm: I would do everything again at 8 pm: withdrawal the distrust Italy deserves better. no more play. gd young democrats chieri, 1
102.jpg, 38994,2019-08-20,0, "Di Maio, Conte, Salvini", "ouch ouch ouch ouch, but you swear that in a little while you will go, ouch ouch ouch ouch, in the end, however, I don't do you ever ", 1
103.jpg, 344,2019-08-20,1,0, "" "good evening, I was passing by here, I heard that this armchair is free ..." "", 1
104.jpg, 447,2019-08-10,0,0, the delusion of omnipotence of salvini united left, 0
105.jpg, 381,2020-01-24,0,0, when they ask you if it is worse brothers from Italy or the league: shit is shit, 1
106.jpg, 6,2019-08-27,1, "Salvini, Di Maio, Zingaretti, Meloni, Mattarella", we are not here! let's try the Bible again - no, nothing to do! try again! ba - cio - ni finally! has a very powerful aura!, 1
107.jpg, 137,2019-09-05,0, Salvini, the death of de andré, 0
108.jpg, 19,2019-08-09,0,0, "this year, in san lorenzo, we will see falling little stars!", 0
109.jpg, 22,2019-08-20,0, "Salvini, Di Maio", el arte nos rescues, 0
110.jpg, 19,2019-08-08,0, "Salvini, Conte, Di Maio", game over, 1
111.jpg, 41,2019-08-27,0, "Salvini, Berlusconi", we are from the league we are not attached to the armchair: we are going to elections! boss ... emanuele filiberto throws himself into politics. I changed my mind I'm staying here! let's make peace! the throne is mine !!! my! all mine! my my! mioissimo! ... it was once mine ..., 0
112.jpg, 242,2019-08-25,0, Renzi, "get your hands dirty, do some shit. I'm black belt of shit. Be curious and ask yourself why. You have to accept to risk. To fail. It is part of life . the champion is not the one who wins, but the one who gets up. the mechanism by which it seems that failing is an unrecoverable fault has passed through us. matteo renzi ", 0
113.jpg, 18,2019-08-17,0, Salvini, "verdict not kept" "in a few months repatriation agreements with at least 10 countries" "checkpointpromesse", 0
114.jpg, 29,2019-08-17,0,0, "cgia mestre 17 minutes ago the craftsmen close the shop: 6500 companies disappeared in 6 months the drop in consumption, taxes, soaring rents and access credit factors ... ", 0
115.jpg, 6,2019-08-29,0, Di Maio, "29 August 2019 by maio and the professor premise: I am certainly not an uncritical fan of the new government that is being formed, but the idea that salvini - that as you know, I do not appreciate at all - it is badly done by myself, of course, I am not sorry at all. the person to the left of di maio is clearly the professor of the paper house, so we will no longer have liquidity problems. ", 0
116.jpg, 27,2019-05-13,0, Salvini, "it could happen to you too, use a condom", 1
117.jpg, 4466,2019-09-10,0, "Salvini, Meloni, Di Maio", anonymous alchemists ademia thymine uracil anonymous alchemists, 1
118.jpg, 13,2019-08-28,0,0, democracy is dead, 0
119.jpg, 419,2018-05-11,0, Salvini, now only the spread is raised, 1
120.jpg, 6,2019-08-28,0,0, "di maio:" "it takes a person who is a sure guarantor for the new coalition with the new left political force." "Giuseppe conte:" 1
121.jpg, 8,2019-08-31,1, "Napolitano, Monti, Draghi", club bilderberg, 0
122.jpg, 190,2019-09-12,1, Salvini, "unpublished work by Modigliani found entitled" "high necked coglioncino" "", 1
123.jpg, 53,2019-09-09,0, "Salvini, Meloni, M5S", "Salvini who demonstrates in Rome against the Italian government, when until yesterday he set them on fire in the square", 1
124.jpg, 28,2019-08-22,1, Conte, the government is over! go fuck!, 1
125.jpg, 4944,2019-08-20,0, "Conte, Salvini", at the end of the debate I will go to Mattarella to resign my resignation. giuseppe conte, 0
126.jpg, 24,2019-08-27,0,0, "concluded on Tuesday of consultations, on Wednesday Mattarella will meet the main political leaders. For now, in the hands of the President only a handful of flies ... daje that tomorrow there will be are lemmerde !! dajeeee !! ", 0
127.jpg, 119,2019-08-30,0,0, "you deserve a love like Enrico Mentana, who in the face of crises does not run away but, on the contrary, can't wait to talk about it 6 hours in a row without feeling fatigue . #maratonamentana ", 0
128.jpg, 470,2019-08-20,0,0, via salvini, 0
129.jpg, 367,2019-08-31,0,0, "alarm from the sovereign propaganda:" "with #governocontebis there is the risk of seeing the egalitarian marriage approved, gay adoptions and a norm against homophobia" ". what has been the law in all civilized countries for years? ", 0
130.jpg, 43,2019-09-06,0,0, "strangers who on instagram, instead of writing me porn stuff or going out on the pea, invite me to join the new calenda party. But where the fuck am I wrong?", 0
131.jpg, 151,2019-08-13,0,0, "a matte 'mo’ enough, do your rallies alone! ", 0
132.jpg, 25,2019-07-22,1, Salvini, "rabbit, crab, dog, rooster, snail, squirrel, crocodile, dove, bull, elk, elephant, salvini", 1
133.jpg, 2343,2020-04-27,0, "Conte, Casalino", every nation has the first lady it deserves !!!, 1
134.jpg, 5,2019-09-03,0,0, "be digital, get more @managementdigitale", 0
135.jpg, 5,2019-08-08,1, "Salvini, Di Maio, Conte, Toninelli, Appendino", choose life. choose a job. choose a big fucking amendment. choose the subjunctive. I chose something else. the reasons? there are no reasons. who needs reasons when having cost-benefit analysis? # 1 matteo # 2 chiarina # 3 peppe # 4 danilo # 5 gigi tavspotting a film by danny bollisse, 1
136.jpg, 438,2019-08-31,0,0, "vujadin boskov @vukaboskov to make #governodisvolta need to decide which way to go and put an arrow, do not continue to quarrel for those who sit on the front seat 13:30 21 / 08/19 twitter web app ", 0
137.jpg, 45,2019-01-20,0,0, salvini a matera, 1
138.jpg, 302,2019-09-03,0,0, "hello, I am rousseau, your democratic assistant. What do you want to decide today? Yes no", 1
139.jpg, 52,2019-08-26,0,0, "count like that of" "white, red and green" who returns to Italy to vote. Silent for the whole trip until, in the end, he sends all fuck ", 0
140.jpg, 37,2019-08-09,0,0, salvini or maio who said that? a year of government in 266 statements to guess 24 hours, 0
141.jpg, 58,2019-08-20,0,0, "when you read that another" "count" "has resigned ...", 1
142.jpg, 5,2019-08-21,0,0, "why don't we give lampedusa to spain? In this way it would always be the first safe harbor where NGOs can dock, but at least it would be on Spanish territory ..", 0
143.jpg, 22,2019-08-21,0,0, announce that they want to pull the plug on the government to look forward to the spoils of the elections to realize belatedly that they are in a parliamentary republic to say that the fall of the government is the result of a previous agreement pd -5S, 1
144.jpg, 25,2018-08-13,0, "Conte, Di Maio, Salvini", "genital 1, genital 2", 1
145.jpg, 263,2019-08-31,0, Hanger, "clear hanger and virginia Raggi" "giuseppe conte is a guarantee for all Italians let's go on" "", 0
146.jpg, 3,2019-08-11,0,0, matteo renzi vs. matteo salvini the five stars try to remedy and recruit don matteo, 0
147.jpg, 5,2019-08-21,0,0, "like a swallow does not make spring, a nice speech does not cancel a year of" "yes yes sir, always" "", 0
148.jpg, 51,2019-01-15,1, Salvini, salvini carabiniere. policeman salvini. salvini blocks ports. salvini visits the northern armories. Salvini goes to Putin's house. salvini captain. salvini, 1
149.jpg, 26,2019-08-21,0,0, "brontoloebasta salvini: i want 'or divorce count: ok, ma' e criatur anna remained cu me", 0
150.jpg, 604,2019-08-11,0, Salvini, "silence and political falsity crisis government, labor:" "do you want to see that salvini has beaten her big?" "", 0
151.jpg, 432,2019-08-30,0, "Grillo, Di Maio, Renzi", evolution v-day grillina you just never mess with the pd today, 0
152.jpg, 85,2019-09-03,0, Civati, giuseppe civati ​​therefore it was not salvini who presented a motion of no confidence but it was the merkel who dictated the motion of no confidence to salvini who then presented it in Senate. now everything is clear. # Colpodistatus, 0
153.jpg, 82,2019-05-12,0, Salvini, "Italy, 2019. The discussion on the Basaglia law that, with the closure of the asylums, left thousands of mentally ill people in the street, is rekindled.", 1
154.jpg, 187,2019-08-21,0, Conte, "and who do you meet there is a beautiful, rich, important woman ... with ...? Noo! ... personality!", 1
155.jpg, 20075,2019-08-27,1, Mattarella, luca parmitano publishes photos of the balls of mattarella from space, 1
156.jpg, 816,2018-03-28,0, "M5S, PD, Lega", what the fuck is pd doing? his best, 1
157.jpg, 64,2019-08-12,0,0, "ilgiornale.it carola rackete world:" "the german government ordered me to bring migrants to italy" "unmasked!" "Order to put salvini in trouble" "stop ong I'm with the captain!", 0
158.jpg, 261,2019-08-17,0,0, "if even maio and conte allow themselves to deride him, it is the end of salvini. Shortly: the papeete calls boldrini as dj - putin turns off the gas - the sweatshirt shops display signs with his I do "" I can't enter "" - the virgin mary appears to him saying: "" get off your feet "" ", 0
159.jpg, 99,2019-08-26,1, Conte, italo calvino the biscuit halved modern classics oscar mondadori, 1
160.jpg, 141,2019-08-17,0,0, "god salvini:" "we have against all the powerful" "happens, especially when you ruin the holidays for nine hundred and forty-four parliamentarians, the president of the republic, all journalists , to pollsters, analysts, commentators, TV operators, printers and community managers. ", 0
161.jpg, 67,2019-05-27,1, Salvini, "you of" "or strunz" "will be the first to be deported", 1
162.jpg, 51,2019-08-26,1, "Brothers of Italy, League, Forza Italia", center-right coalition in 2019.1
163.jpg, 27,2019-08-20,0,0, when you can do a Mentana marathon even on a hot August day, 1
164.jpg, 629,2019-08-09,1, Salvini, ok the Italians have given me full powers, 1
165.jpg, 10,2019-08-25,0, Mattarella, "" "but what elections that every time you vote to fuck" "", 1
166.jpg, 131,2019-08-22,0,0, "I would not like to be in the shoes of salvini who, after the fall of the government, will have to return to insult the southerners, pray to the volcanoes and clean his ass with the tricolor. Dario lenient ", 0
167.jpg, 6,2019-08-10,0, Salvini, "I knew from the beginning that in the end you would be gone after taking everything away from me ... you know gigì ... it's the thing I like most about noir: the protagonists know what their destiny will be, nevertheless they go all the way. ", 0
168.jpg, 98,2020-05-05,0, Salvini, "last night, watching TV my daughter asked me" "dad, but why do you insist on ste ste demmérda figures?" "", 1
169.jpg, 940,2019-09-03,0,0, "there is a person I would like to thank from the heart, among others, for allowing the fall of Matteo #salvini and the birth of a different government. And that person - I say it with gratitude - is salvini matteo. #maratonamentana ", 0
170.jpg, 180,2019-08-21,1, Salvini, raffo, 1
171.jpg, 66,2019-09-03,1, "Di Maio, Di Battista, Fico", are not professional politicians: they are taken from the street, 1
172.jpg, 467,2019-08-27,1, Salvini, "hello baby, do you want a boat? Things at random.org salvini", 1
173.jpg, 31,2019-08-10,0,0, "come on, don't be pessimistic, look at the glass half full of shit. Kutoshi kimino & luca filipponi", 0
174.jpg, 11910,2019-08-29,1, "Salvini, Mattarella", ... you cannot vote!, 1
175.jpg, 370,2019-08-23,0,0, from Tuesday new consultations, 0
176.jpg, 1307,2020-10-04,0,0, giuseppe want the loan, 1
177.jpg, 25,2019-08-09,0,0, do not confuse the crisis of government with the crisis of self-government, 0
178.jpg, 11,2019-08-25,1,0, rousseau participates in the change. rousseau is the 5 star movement platform where you can express your ideas. today we don't care how you think. don't show this message again, 1
179.jpg, 4,2019-11-25,0,0, when all the League players join in a rally and start talking to each other. apes together strong, 1
180.jpg, 5,2019-08-20,0,0, it is necessary to orient the training system towards digital skills. giuseppe conte, 0
181.jpg, 94,2019-08-28,0,0, I want to go to the vote. it's my right, 0
182.jpg, 8,2019-08-10,0,0, who knows if the stars make a wish when a government falls ..., 0
